sentence_1	sentence_2	score
Underrated and underappreciated.	CaptionsBonus MaterialI Mickey and The Beanstalk DVD StorybookII	1
came quick, priced ok, was cute and made great christmas gift for lil girl, great quality and was very happy	great quality and great price	0.6341591477394104
When Belle finally announces her love for the beast, I ask myself why.	So glad I finally found this  why isnt it replayed on TV	0.33163729310035706
And adults can easily throw the game or handicap themselves by letting the little ones see under what they uncover increasing their ability to win.	It is also good to see something that lets ordinary teens see that goofing up doesnt have to mean failure  	0.47271353006362915
The talking Lotso was too rich for my blood, as I didn't think it would get played with much.	That  being said I would buy them again for the amount they get played with	0.4777578115463257
Slap stick is close to the only comedy u get these days with is boring!  	For me, as an adult, it's a typical Disney story.	0.09951671212911606
Dean Jones was perfect for the roll	This was perfect	0.7601447105407715
Each episode is shown in its entirety with the Walt Disney intro making the episodes clock in at approx.	Each episode is shown in its entirety with the Walt Disney intro making the episodes clock in at approx	0.9745165705680847
got this for my now 25 year old stepson for christmas.	Bought this for my 25 year old  	0.8784950971603394
A wonderful romp into the world of the monsters under our beds, and in our closets.	It actually made her less afraid of the monsters in the closet and under the bed	0.4724251925945282
I loved this as a child, and was excited to give to my 6 year old for Christmas.  	Also again when it comes to coming up short on personality this is a contradiction of the company who established personality in the early to mid-thirties when they were technologically building up their company.	0.04931064322590828
It's a strange fantasy world inhabited by weird creatures.	really great purchase!	0.04301975667476654
Great stuffed animal to go with Doc McStuffins	Its a stuffed animal	0.8279807567596436
In fact he gets to be heroic for a change....	Fess Parker forever will be remembered as the REAL Davy Crockett although what real historical fact may be somewhat different he nonetheless became the role model for kindness chivalry honesty and courage for us guys back then	0.48036548495292664
These decorations are exactly as advertised.	she said it didn't look like the character at all....	0.1325611025094986
In the nick of time little Medfield College, incompetent Dean Higgins and Dexter Riley prevail against the seemingly insurmountable odds.	The animation is astounding and to imagine that ít was drawn by hand is amazing.	0.16321253776550293
I laugh and I cry.	I laugh and cry every time I watch it	0.5850396752357483
SCTV's Rick Moranis and Dave Thomas are pitch perfect as moose versions of their McKenzie brothers (and deliver comic gold on their in-character audio	On a comic footnote Brother Bear also features the voices of Rick Moranis and Dave Thomas as Rutt and Tuke moose characters reminiscent of their beerguzzling McKenzie brothers from SCTV and Strange Brew because this is a familyoriented cartoon  and it would be inappropriate for the moose to quaff beer  the two moose express a fondness for eating wheat hops instead	0.5327819585800171
I especially enjoyed the extended version with extra song that just seemed to tie everything together.	However, the fleece is guarded by a Sleepless Dragon.  	0.053786806762218475
I enjoyed watching it again, and visiting "Neverland" again.	Worth buying and watching again and again	0.5340744853019714
Overall, this is an excellent presentation of what IMHO is Disney's finest work.	Almost every main character in the film is a brilliant little masterpiece showcasing some of the very best work done by some of Disneys greatest animators	0.5101721286773682
To write the story of Alice in Wonderland Lewis Carroll had in some way become conscious of the meta-physical world.	While I enjoyed the film as a child, I must admit that it is not the most memorable Disney film nor is it a film that I watch often.  	0.10057008266448975
Ellen D. is absolutely hysterical as the forgetful fish in this cartoon, not to mention the premise was great as well.  	The story is wonderful and the characters are so loveablenot to mention the animation is absolutely breath taking	0.3360997140407562
Bambi discovers life and love and growing up becomes the spitting image of his father.  	A good variety and some part interchangeable so that's nice.  	0.07292893528938293
How about the alcohol and the saloons?Aside from that, I would have bought this DVD for just Johnny Appleseed.  	I bought it for Christmas  	0.5339778661727905
This doll is SUPER cute and SUPER soft!!	These sheets are well worth the price.	0.06252926588058472
this is a classic that the whole family can watch and enjoy i could watch this one over and over	We can watch it over and over  	0.6564666032791138
(you really shouldn't assume any "based on a true story" production was taken directly from the midst of the situation it's relating anyway!)as for the Chip & Dale cartoon, well, they were never particular favorites of mine, although i've always liked The Lone Ranger, which enables me to enjoy it as being a parody thereof.	The stories look like they were pulled straight from the comics  	0.4069712162017822
It would be un-American, and we certainly wouldn't want that, would we!A gift for my grandchildren.	I wouldnt be  	0.4155590832233429
Do they have an old wise woman/man?	Im getting old	0.5502992272377014
The movie is cute and the G rating is appropriate.  	This is a really cute movie	0.6500300168991089
The kids still love it.  	My kids love Special Agent Ozo	0.770226240158081
The voice of Ellen was so well done.	This was well done	0.586948037147522
The thing is, the characters aren't as sympathetic as in some of the other shows.  	It looks like the characters were drawn yesterday	0.4285506010055542
One can't help but wonder where the falling out between Bambi's dad and mom happened and why?	The animation in this movie is absolutely amazing and the characters are so life like.	0.07082627713680267
The sheets are very soft, almost a satiny feel.  	The sheets are soft too	0.6058531999588013
I liked it; I am not saying I did not chuckle a few times when the main character Zaphod BeedleBorz played by Sam Rockwell, lost his other brain and used his 3rd arm to get ice.  	I wanted something she could easily carry and that would appear lovable.	0.04736102744936943
With just getting out of jail after serving his time for robbery Nick Nolte goes to the bank to cash his check so while been  served a  little man decides he'll rob the bank for money to help his daughters school fees.	Calling himself the Spot he tries to steal money to fund his research	0.44802671670913696
They're good representations, and since my son wanted them for standalone play, they will work just fine.	I will collect all of them because they will nice in my display	0.4590032398700714
I use this with a clear liner on the back of it for he kids bathroom.  	Great price and fast shipping.	0.04873116314411163
The DVD version is as clear and high quality as an original broadcast, wonderfully done!	How can you not love a classic?	0.08003260940313339
A great price and packaging with on time delivery.	Great price and beautiful	0.6209506988525391
Magica’s Magic Mirror:  Magica uses a pair of magic mirrors to try to get Scrooge's Number One Dime.  	the magic of Disney  	0.4675769507884979
Deleted Song: "Silence is Golden" (Song Demo)*	Deleted Song Silence is Golden Song Demo	1.0
A few people didn't like this film, but I for one honestly thought that this film was good.	Unfortunately, everything was much smaller than we expected.  	0.034399546682834625
He opened it at 8:30 and carried all 7 airplanes around for 3 1/2 hours.  	Ages 7 to 12  they got all the jokes  	0.379958838224411
Love the 3d version, just like being in the ocean.	I have a 3d tv and the 3d is ok  	0.7326259613037109
***This review may contain spoilers.***Disney's "Beauty and the Beast" (hereafter B&B;) is an uncontested masterpiece (and anyone who dares contest its greatness is, in my opinion, a brainless, heartless fool).	How can you be so heartless	0.42976388335227966
My favorite scene in the whole movie is the tractor tipping, which I can see Larry doing.  	While looking for cake decorations we decided to get these figures instead.  	0.025922400876879692
The forest scenes are surreal and beautifully lit.	Like most of all of DISNEY productions TARZAN got amazing scenes with beautiful graphics and songs	0.5120469927787781
The story about persisting in the face of obstacles, adapting and overcoming,  is exactly what I need when I feel like crap.  	This animated feature will become a tale of characters finding their own strength facing their fears and overcoming minor challenges and seemingly insurmountable obstacles	0.24892783164978027
The animation for "Peter Pan" still holds up to this day and with this Blu-ray release, I'm quite pleased with the Diamond Edition as it continues to carry the quality that Disney has done previously with their Walt Disney Animated Classics series on Blu-ray and really giving fans what they want in terms of pristine picture quality, crisp lossless audio and a plethora of special features.	Amazon must have gotten tired of my inquiries because there appeared an Amazon e-mail with the Little Mermaid available to ship, no shipping charge, and I received it within seven days.  	0.18948860466480255
A great deal on an absolute classic, this is a must buy.	This is a classic	0.2115985006093979
As the players move along there will be more and more treasures to look for and so the kids have to try to remember what was where.	Correct answers are rewarded with gems to be placed on tiaras rings and braceletsMy young nieces and their friends were familiar with all of the Disney Princesses so it wasnt too difficult for them to guess the princess identities or provide visual clues to other player to guess which princess she was pretending to be  	0.46829190850257874
Yet I have seen some younger reviewers on here who appreciate the good material Disney used to produce.	As a Disney enthusiast I appreciate when these things are well taken care of which this was	0.4356516897678375
And you can't beet the price was also very good.	The price was really good too	0.691904604434967
Makes agreat Birthday or christmas gift for all the Tangled fans out there.	HIGHLY recommended for fans of old TV Disney fans Fess Parker fans or anyone who like semihistorical TV	0.5373088717460632
Two Leaves - (3:07) An original concept of how Disney and crew were thinking of creating dialogue between two leaves but opted not to use it on "Bambi".	You can select this method and what it is is actors performing the original sweat box meetings where they discuss developing the entire movie  	0.37414106726646423
We love this movie.  	I love this movie	0.6556295156478882
It's a wonderful story based on the innocent explorations of a son (fish) and the devoted father who is determined to bring him home.  	great story and cute fish	0.2975885570049286
We will use this for quite some time until she gets big enough to sit in the tub.	As my young son is into toy story, I quickly bought this.	0.08328725397586823
Worse, Gaston is not a pariah as a villain ought to be--even high-ranking wicked stepmothers are not royalty, and in fact they're often gold-diggers.	The prince really learns no lesson at all in the beginning he shuns the old hag she is ugly and is cursed to live as a beast and must love someone presumably for who they are on the inside but Belle is constantly referred to as the most beautiful girl in the village	0.39097359776496887
i have bot seen this movie in a long time and when ai rewatched it i was still amazed on how well it still is.	But this movie is still enjoyable	0.5068020820617676
However, it turns out there is a very old law on the books that states that a woman cannot ascend to the throne without a husband, and another royal relative seeks to exploit this and place his nephew, who is next in line, on the throne instead.	Why the throne has to be handed off now with the Queen still in such good shape is never actually explained and for some reason it doesnt occur to anyone initially to try and change the law	0.5051848888397217
We have had this hamper for 3 years and now both my 3 and 2 year old still play with it	Afters and so on).What we have here is a cutesy CG piece that by no means pushes the animation envelope (even for 2005 standards) that works off the tried and true formula of decent narrative rather than retina-popping visual appeal.	0.12281487137079239
Chilly gets 5 stars!I would recommend purchasing this.	I would not recommend purchasing this product	0.7203773856163025
I've watched this movie many times and it never gets old.	The acting is fantastic and never gets old and I have watched it many times  Recommend this movie for families and all ages	0.6983882784843445
These days however, the soundtrack does not receive nearly the attention it should.	Great soundtrack too	0.46774616837501526
Anytime you watch the film and press pause, you get a random interactive moment during the menu pause.	The movie of course looks spectacular and the intermission animations are awesome	0.29916977882385254
He chases the bear up onto a mountain and kills it.	A great present for those who saw and enjoyed the movie.	0.09676294773817062
This doll is quality materials with a beautiful dress.	High quality doll with good details	0.7121758460998535
The Cheshire Cat was voiced by Sterling Holloway who also played Winnie the Pooh and Kaa the Snake in The Jungle Book.	First this is the first Peter Pan that a male actor played the lead in previous plays and movies Peter Pan was played by a female	0.5041378736495972
Gets me every time	I cry every time I see it	0.5628076195716858
Toys are so much better now then when I was a kid.	This one is so much better  	0.6141403317451477
None of them work very well.	He gets caught in a trap, but is freed by a chatty bear cub named Koda (voiced by Jeremy Suarez).	0.0025707718450576067
I remember hearing about this movie when I was in high school.  	Plus, you can't beat the price if you buy it on Prime Instant and you don't have to store the dvd.	0.01223043818026781
and it pilled pretty badly over the white	The material is a little thin so we layered with a pair of white long johns and it worked great	0.4176888167858124
and I LOVE Dory!	Disney  Pixars’s Monster University and Disney  Pixar’s Planes	1
It's a great concept.	He would have had a lovely time with this concept though	0.23137375712394714
See you in another 8 years!!!	A Lesson in Flashbacks 8 minutes	0.5256799459457397
I know with today's cultural climate of greater awareness of performance enhancing drugs and doping in collegiate and professional sports, this comedy can't really be called timeless but, it was fun to watch as the third and final installment in the saga of young Dexter Riley, boy genius. :-)	Nobody makes cartoons like PixarIf The Incredibles Finding Nemo Up Toy Story and WallE arent the greatest computeranimated films ever made blending humor heart and smart entertainment then Ill eat my hatCars could also be added to the list as it seems that young boys between the age of 37 cannot STOP watching it	0.4422586262226105
I also only put 2 or 3 screws in the whole thing, because I'm not risking tightening it and pushing the wheel part down again lolConfusing, right?	lolUpdate took it apart again and noticed the little wheel piece that connects the bottom of the rubberband to the gears	0.4660642743110657
Gather up the popcorn, settle in with your feet up and relax for a fabulous night of entertainment with the family.  	I'm joking right?	0.1718444675207138
I ENJOYED THIS MOVIE VERY MUCH.	YO LA VERDAD PRESIENTO QUE	0
The film is a magical blend of terrific storytelling, beautiful animation, wonderful music and great voice acting.	Great story great animation great songs by Phil Collins  	0.4619239866733551
I like it, but I have a saltwater reef aquarium and I'm a big Pixar fan, so it's to be expected.	It was not necessary.	0.024472946301102638
only used with a few toddlers clothes and there is already 2 tears in the top seams.	This product is great for toddlers  	0.4238385856151581
Beauty and the Beast, is a great movie for ALL ages, and family for entertainment.	A fun and great movie for the whole family  	0.7237666845321655
I GREW UP WITH PETER PAN AND REALLY ENJOYED IT.  	YO LA VERDAD PRESIENTO QUE	0
no, really?  	no complaintsoverallGET IT	0
I bought this baby book for my son, and it is very cute.	This is a very plush and cute Sulley.	0.22662168741226196
My daughter refused to sit up on her own until she was 9 months, even though she could.	My daughter loves her Lambie although she is over priced lol  Lambie helped her be a real Doc McStuffins for halloween	0.49400532245635986
Lightning McQueen (voiced by Owen Wilson), a brash NASCAR rookie who unwittingly gets lost and ends up in Radiator Springs, an almost-ghost town and former hot spot along historic Route 66, now ignored by tourists and travelers alike, thanks to the superhighway that bypasses the town.	A mishap en route to Californias Piston Cup to settle a 3 way tiebreaker lands him in a lazy southwest desert town occupied by old forgotten automobiles where McQueen learns that the universe doesnt revolve around him and that sometimes we all need to slow down and smell the roses	0.41255465149879456
Even if you don't believe in Catholic Christianity or patriarchy, as I do, I would hope that an open mind and an open heart would recognize that this kind of plot line depends upon people already being familiar with "the way things are", in order to question the wisdom of their being that way, and so this kind of story depends upon the very thing it's against, in order to make sense.  	There was again a sense of purpose and philosophy to the plot and I really do expect that there be at least some plot and some kind of purpose to a story  	0.44298526644706726
and if you are a dog lover you will probably enjoy this movie.  	THE MOVIE:I loved watching the Disney animated films on VHS when I was a kid, but as I got older I tended to favor the more recent Disney hits ("Aladdin", "The Lion King", etc.) over the original classics.  	0.07113166898488998
Couldn't have put it better myself.  	If it did I think it would help keep it in place better	0.4429502487182617
All loyalty to Pan seems gone.	He seems to be well made	0.3067271113395691
However, the pieces are big and easy for her to interconnect.  	The pieces are very large so it is easier for her to pick them up	0.6294548511505127
Our daughter does everyone's hair that comes over, including our dogs hair.  	But all the girls have real hair wouldnt we HATE plastic hair on them  	0.40610191226005554
If you watched the tv show, you will like this one.	If you like Dick Van Dyke and his TV show then you will like this movie  	0.42973870038986206
It is so good and fun and a neat presentation of the book.	Very cute and entertaining	0.6660966873168945
I give this set five stars for its content, not for the set itself.  	Im happy to give her 5 stars	0.6719020009040833
Maybe that's the point, as I've not read the book this is based upon, but it doesn't fit well in my mind of a Disney classic, especially one that formed a major pillar upon which the entire Disney franchise was based upon.	The 1951 animated classic is based mostly on Lewis Carrolls Alices Adventures in Wonderland with a few elements from Through the Looking Glass  	0.38392123579978943
this movie is about friendship and love.	I bought this for my grandson's birthday.  	0.09837500005960464
Bambi gets my vote for the most beautiful story Disney has ever told.	great story wonderfully told	0.34184205532073975
This one is a classic.  	This is a classic	0.305205762386322
Very cute though.	He reminds me of the classic Pooh narrators.	0.04155898094177246
And literally an orchestration that would shock America.	It was a shock to the public to find out that they would not air a program in fear of a lawsuit  	0.4200328588485718
Likely due to the Multicannel PCM sound signal.	The story is a little slow, but it picks up speed as it goes.	0.03583239018917084
If Bongo was shorter, if the ventriloquist was completely absent, and if there was more connection between the shorts, then this would be great; 4 star, maybe even 5.	Overall this is a set I wouldnt pass up if youre a fan of Disney animation but it would have been great if more care was given to the shorts	0.3883987069129944
And frankly, Nemo got what was coming to him.	Monterey Jack's father, Cheddarhead Charlie, blows into town for a visit and attempts to teach the Rangers a thing or two about adventurin' the Cheddarhead Charlie way!  	0.0009874285897240043
i love this movie, love the characters, espicaly crush.	I love love love this movie	0.8413488268852234
The quality is perfect and this movie never gets old.	The movie is a very good quality	0.7168669700622559
It did play at home.  	GEEKY, I know but let's face it if you are even reading this and thinking of buying this hat then you are right there with me.	0.06794227659702301
He is happy watching it	I'm not really sure what the point was in creating it...	0.01883581653237343
I would recommend this to those who loves watching 3D or blu ray.	Didn't have to skip any parts for younger kids	0.09200836718082428
Buy this movie for its charm, its humor, its compelling story, and its heartfelt message; that you're braver than you believe, that you're stronger than you seem, and that you're smarter than you think.	Actually its more than that	0.5810579061508179
Doc McStuffins products are hard to find in stores and online, so this was a great choice for us.	Coral gallantly flees to defend her unborn offspring as her mate pleads with her.	0.12050630152225494
Featuring voice-work from some of old Hollywood's greatest character actors, the animators seemed inspired to explore the limits of their wildest imaginings...creating a Wonderland of marvels, wackiness and more than a bit of real danger.	Now keep in mind the film playing is not the entire image, it is mixed with sketches, drawings, paintings, test animations and pictures of the animators working, etc.  	0.0955834686756134
I bought this thinking there would be more Mickey Mouse and was disappointed when there wasn't.  	I had not seen On Stranger Tides and was disappointed it did not have Orlando Bloom and Kira knightly in it	0.47250962257385254
My daughter loves this show and so do I.	My daughter loves this	0.8004214763641357
Anyone else having problems playing the Special Features on the Blu-ray disc?	Because they sent a disk that wont play in the US	0.3136153519153595
We kept ours up for an entire week.  	Three whole recordingsactions  	0.4839896857738495
Seriously?")That said, the film is still a visual feast, abounding in sight gags both large and small.	I have pictures of both posted if want to get a visual on either con  	0.5634288191795349
My two year old will probably be bored with it before we get our money's worth	My 2 year old is Mickey Mouse Clubhouseobsessed so I got this for him for Christmas  	0.5240334272384644
Peter Pan is an excellent movie and gets an AAAAA+++++.	This is an excellent movie  	0.8416130542755127
He just didn’t really seem to do anything.  	It probably wont show off your system like a super hero movie but it does sound really really really good	0.3489801287651062
I took this out of the Disney rotation.  	Other than that its been on heavy rotation ever since it was delivered 	0.24166052043437958
City of Stone:  Demona plots with Xanatos to steal one minute of life from everyone in the city, an excuse for how she's lived for over 1000 years.  	Unlike a lot of the other dolls, it really looks like the character its supposed to portray.	0.08150215446949005
In their own language!	No language problems  	0.0021398155950009823
Finally on the last day of the expedition Clayton tricks Tarzan into taking the group to see the gorillas.	Tarzan eventually leaves the camp when Kerchack and the other gorillas show up	0.2831425964832306
The primary mode is where you have to select a car from the bottom of your screen when it shows up in the movie.	The arguments that show the unsubtle darkness of the film come most prominently in two points of the film after Pinocchios first performance in Strombolis puppet show where he makes plenty of money for the puppet master he says that he is going home and will be back in the morning	0.3882167637348175
It is now able to shot an arrow 10-15 feet without much effort.	I have a huge screen in my theater so it wasn't too bad, but I could see where this would be irritating to most home viewers.	0.04456665739417076
It is just a really fun, family movie.	It is a family movie	0.6338904500007629
I am happy to do bussisness with this seller!!	Very happy with the seller	0.5028508305549622
Rated "PG-13".	YO LA VERDAD PRESIENTO QUE	0
I think it is really well done, and a funny story that adults can watch too	My toddler loves it and adults can watch it as well as it is humorous and has an engaging story	0.7123776078224182
and it was incredibly depressing.  	We bought these wings to go with the Buzz Lightyear deluxe costume, and it really made the costume whole!	0.16317400336265564
The film focuses on two particular monsters, Sully and Mike.  	There are also 2 sequels to this film The Cheetah Girls 2 and One World	0.5866004228591919
