sentence_1	sentence_2	score
You definitely must have this film for your collection.	If you dont have this movie in your collection you need it	0.524354875087738
I paid $20 for it, a dollar for every above average episode & 5 good ones for free.  	We paid twenty dollars and it has been a good value	0.26437991857528687
he loves it!  	She loves it	0.8847312331199646
Pedro and Cleo both have personalities without even saying a word.  	Maybe for an adult or collector they'd be fine, but for a kids toy they are very badly designed.	0.03683342784643173
The musical score is fittingly haunting and rich, most effective in the prologue, the west wing and the transformation sequences.	Case in point Lampwicks transformation scene is terrifying and extremely effect even now	0.4612194895744324
Looks realistic to the real Lotso from the movie.	They really made this movie realistic for Nascar fans  	0.6443777680397034
This game is a hit with the little princesses.	This is a really fun game for little girls who like princesses  	0.399379163980484
There is a surprising amount of emotional depth, character development, and humor to the film that I don't think was present in many of the early Disney films.	This film will not stimulate any bellylaughs however the subtle humor of many scenes is worth noting  	0.539111316204071
Buy this now!  	Do you get it now  	0.26905396580696106
I'm sure most everyone knows the story of Peter Pan so this review was basically just to say it is a great movie, and a great buy, and we are so happy to now have it on dvd.  	Everyone knows the story and I am sure most people who are purchasing this have already seen the movie so I wont be discussing the movie  	0.36951199173927307
All loyalty to Pan seems gone.	A beautiful movie about love friendship care and loyalty	0.40640971064567566
It celebrates life and love and beauty.  	You have to love Jake and this one is a beauty	0.40252357721328735
I couldn't have asked for a better fit if we'd tried it on in a store first.	No attempt at any sort of carrelated humor was attempted as far as I could see and I think it was more of an excuse for Pixar to not have to animate people because their people always look a little well scary	0.34537413716316223
I'm sure most everyone knows the story of Peter Pan so this review was basically just to say it is a great movie, and a great buy, and we are so happy to now have it on dvd.  	This movie is great and I am so happy to now have it on dvdblueray I had literally watched the vhs to death	0.4848127067089081
Prehysterical Pet:  In his eagerness to have a pet of his own and prove he can handle the responsibility, Dale secretly takes in a tiny Dinosaur visiting from another planet, but the more the Dinosaur eats, the bigger he gets!  	But once when little Nemo and his friends venture out too far and Nemo is rebuked by his father he draws further away from his Dad resulting in his being fishnapped  by a diver named Phillip Sherman Bill Hunterwho will keep him in his dentists office aquarium near Sydney Harbor resulting in Marlin beginning an odyssey of his own to retrieve his sona journey on which he will be greatly tested	0.516129732131958
Finding the Story2.	Story Telling the Taleb	1
I got these to go with the "Disney Princess Ariel's Bath Time Playset".  	so the will love this Bullseye to go with him	0.5450222492218018
I need to keep my toddler occupied so I like to have several good movies on hand that he can watch and that the rest of us can also watch without getting too bored.	I like having the movie so I can watch it any time I want	0.5351065397262573
The.only thing I don't like is the price 15$. I can buy it for cheap from walmart.	Great buy for the price  	0.7318969964981079
Nice eric doll, mu daughter loves it . . . . . . . . . . . . .	My daughter loves it	0.20968377590179443
It must have been a challenge to portray such a well-known face and he did a very good job.	The writing is much choppier, and the storyline not as compelling.	0.07258740812540054
It's a powerful early cinematic example of man versus nature, a message that will surely impact your kids in a good, penetrating way.	And although it may not be overall as strong as the original maybe treading into territory we have seen before Monsters University does a good job at bringing some laughs and a decent story with a good message for the kids	0.36437124013900757
I had it on VCR (really?)	It is definitely  a must watch film.	0.17891144752502441
The size is perfect for a regular size bath tub!	It fits perfectly in my standard size bathtub	0.6669898629188538
Every blade of grass has a 3D effect in Tangled where in Nemo often just the characters are in 3D and the background is flat (you can tell because you can still see it clearly if you peek under your 3D glasses).  	It is a series that you just keep watching because you can  	0.4215671718120575
In their own language!	The language is bad	0.07394301891326904
The bonus materials, besides an interesting "Making of" documentary, include a short animated gem: "The Little Matchgirl", based on the story by Hans Christian Andersen, one of the saddest penned by this rather gloomy spinner of tales, both beautifully and faithfully transcribed to film, in 2006, by Disney's Roger Allers and Don Hahn.	As it turned out  Walt Disney had contemplated making a more faithful version of the story in an animated film and had commissioned some absolutely marvelous artwork by Kay Nielsen  which matches the story to its very details	0.45591431856155396
The critics and Rotten Tomatoes go take a hike.  	Yet again these critics fail to get it right fail to earn this keep	0.4934563934803009
Each character brings out the best in the others while their flaws only seem to strengthen the performances of those around them.	Like I said in my Rescue Rangers review in my favorite DA shows the jokes are funnier the guest characters more interesting  the heroes more sympathetic which makes their adventures even more exciting especially in Gummi Bears whenever they travel to an ancient city of theirs  learn more about their past  	0.4789205491542816
If not I would suggest not getting this or any of the other 4 pack Disney puzzles as they are all cardboard press.	Unfortunately althoguh it does come in a wooden box all 4 puzzles are made of a thick cardboard  	0.548011064529419
I can't even begin to describe how beautiful the picture looks, but the reds are pure fire, the tea party is a kaleidoscope of every vibrant color you could dream of, the Rabbit's eyes are are a hypnotic magenta that I've never seen before because the standard definitions couldn't bold them enough.  	The colors are vibrant there are no blemishes that can be seen	0.41034942865371704
"When you wish upon a star" is a timeless classic and this movie will be seen by generations of children to come.	This is a keeper for generations to come	0.49176251888275146
I grew up with TLM as my favorite disney princess movie and hopefully I can resist taking her out of the box!	One of my favorite disney characters is Ursula the Sea Witch  	0.5841624736785889
I bought this because my grandson got his "coonskin" hat at Disneyland and Iwanted him to see what I thought I remembered from my young TV days.	I bought  the DVD for my son He Likes the Movie and i remember seeing it as a child myself Watching it again brought back memories of my own childhood	0.5437893867492676
my daughter loved the doll and enjoys playing with it.	The doll looks great and my daughter loved it	0.730313241481781
The voice for Sebastian is different but sounds close enough.  	The sound is good 	0.4626982808113098
One of Banderas BEST PERFORMANCES, along with the first ZORO and his role in "THE FLIGHT OF THE FALCON".  	Rushmore stars Jason Schwartzman in his first role	0.5563869476318359
I would often go around acting out parts.	Every actor played their roles superbly in my opinion	0.35750001668930054
Clue cards show relevant details pertaining to a particular princess while the pretend cards reveal the identity of the princess using the "Big Heart Jewel" decoder, then that player has to provide clues as to which princess she's pretending to be.  	The Secret Princess cards where one player pretends to be the princess and other players have to guess are a little harder for her if it is one of the princesses she is less familiar with	0.6092827320098877
l think it is a great family movie	This is a great family movie	0.8773024082183838
The clothes are difficult for little ones to get on and off, but not too difficult for parents.	Great item for a child not to heavy and not hard to clean	0.6592611074447632
He turns to the audience and asks you to believe and say "I believe in fairies."	Ah but Belle asks to view the Beasts magic mirror which can show the viewer anyone they wish to see  	0.4476911127567291
I really like since unlike Rescue Rangers or Talespin  neither Little Mermaid or Aladdin got box set releases.  	and it still looks fine.	0.004309090785682201
The dialogue and presence of the supporting characters was natural, matter-of-fact, and all the more funny for it.	They found the characters engaging and the story entertaining	0.4982902407646179
It's watchable.	Not very watchable for me though	0
Used a 24 hour rental by using the Amazon Instant Video Wii app.	The Golden Fleecing:  After hearing about Launchpad's encounter with several Harpies, Scrooge heads to the Black Sea to seek out the legendary Golden Fleece.  	0.02508750930428505
It's could be fixed by sticking a grip pad in the bottom.	Also has a pillow and a hook to hang up	0.4399527907371521
This is one of my favorite movies from my youth.	This is one of my all time favorite movies from when I was a kid	0.7477930188179016
Best $11 I've spent.	Thank God it was a gift if Id spent good money on itplease	0
However, the fleece is guarded by a Sleepless Dragon.  	The Lost Crown of Genghis Khan  Scrooge goes searching for a crown in the Himalayas which is guarded by a snow beast  	0.5476900339126587
The "jewelry" is (sadly) disappointing.	What a disappointment	0.02733002044260502
I found out after purchasing this car that it was on a different scale than the 1:55 line (it's about 10% bigger), but the kiddo doesn't seem to mind and loves carrying it around.  	My kid is nuts about Cars and likes playing with the little diecast cars put out by Mattel so this was a no brainer buy for us	0.4911319315433502
This was a great buy, great quality and value.	great quality and great price	0.8461020588874817
This is the only 'Alice In Wonderland' that counts.	Almost everything is only on the Bluray as listed below2013 DIAMOND EDITION 2013Bluray Bonus Features	0.6339074969291687
Belle reads and thinks (a bad thing according to the villain in the film) and in her notion of marriage the relationship should be emotionally and intellectually stimulating.	Some of the references between Tim and Jill are of the adult variety but its not a bad thing to have the opportunity to explain the meanings of double entendres within the context of a loving marriage	0.46446117758750916
It is true to Disney idiom without losing sense of the original.	The material is really original	0.1574593484401703
The package said 'bedspread' instead of comforter, and on the back called it a quilt.  	My grand kids will sit there for the entire movie, simply mesmerized!	0.08334558457136154
NASCAR-fans had much to celebrate, as did car-racing aficionados of all disciplines for that matter	Not going to tell you the 2nd movie didn't grow on us but with the same stellar cast in the first, this movie has so much heart and our family loved it.  	0.07024138420820236
However, there is a pretty heavy chemical smell that comes off the item - not sure if it's from the materials it's made with or from the coloring on the jet pack.	The cape of hers is made out of some really nice material	0.37509405612945557
Frank and Ollie is a wonderful behind the scenes look at what happened during the glory time of Disney animation.	CineExplore This is a way to see behind the scenes stuff while watching the movie	0.5534276366233826
The revealed image is clear but not bold.  	Alice is very curious and brave daring and bold but not obnoxious  	0.15217596292495728
I was looking for a simple puzzle for my 2 1/2 year old to build her puzzle skills with.	A wonderful puzzle for a 3 year old	0.6641716957092285
When his parents are killed by leopard, Kala finds the abandon boy and adopts him and raises him as his own son much to Kerchak disproval but tolerates the boy.	It got to me really fast too!	0.05938131362199783
My 15 year old niece decided that she wanted to start collecting the Disney classics.	My 4 year old niece loved it	0.5879452228546143
came on time, and was definitely well worth the price, got it when it was at its lowest price at $25	Its well worth the price	0.6308335661888123
All three were adorable and I was also pleasantly surprised with the size of each the palace pet.	They were pleasantly surprised	0.6333789825439453
Great movie for the kids and the adults.	Great movie for kids and adults  	0.678896427154541
This is not exactly Edgar Rice Burroughs' Tarzan; it's been Disney-fied.  	I cant say its true or not only that the girl was not impressed	0.46818289160728455
If you don't own the film, then the Blu Ray is the ay to go, it looks and sounds fantastic.	The Blu Ray transfer looks and sounds amazing so if youre looking to own Finding Nemo the Blu Ray is the way to go	0.6800099611282349
i do wish however that the cost would be more affordable.	I wouldnt buy it at huge expense but if its going cheap definitely worth it	0.3841894268989563
Not a speck of dust or grain appears in the entire film.	Down to the last speck  	0.554706871509552
All amazing episodes on 3 discs and a must own for fans of retro animation and disney.	Im a huge disney fan  	0.2552545368671417
And of course, the animation is always stunning.	The animation is beautiful	0.7069652676582336
Many of the new cartoons come from Mickey's Once Upon a Christmas, Winnie the Pooh and one from Belle's Enchanted Christmas.	Synopsizes come from Marvel Animation Age  Wikipedia39  	0.5676671862602234
I got them for birthday and christmas presents for my daughter and I know she will go nuts when she sees them and Im sure will never let them go.	but I know my daughter she will want to hold and play with them which is fine with me longs shes happy 	0.44584211707115173
Wish the series was still active.	The series continues	0.7390631437301636
I recommend this DVD to anyone who like Jennifer Garner....	I would recommend this to anyone	0.8008231520652771
Just so that I can be Buzz Lightyear.	How can you be so heartless	0.5646843314170837
Loves all Disney movies, they are all great but her favourites are Cinderella, The Little Mermaid and Sleeping Beauty, I have all three.	Thats all	0.6627798676490784
We have a standard (not elongated) toilet seat.	I like that it fits regular   elongated seats	0.20183540880680084
Finally they released this in 3D.  I enjoyed this film before and enjoy it even more in 3D.  All the laughs and scares jumping out at ya.	I have to say that this feature is quite entertaining and makes you dive better into the film	0.5223252773284912
Shipped quickly and was received quickly.	The Weird Sisters appear and watch as the spell Demona casts instead turns the humans to stone during the night, allowing Demona to easily dispatch them as she remembers her true life.  	0.016609935089945793
Best $11 I've spent.	My day care through age 11 were not interested	0
I'll be waiting on a used one!  	This one was worth the wait	0.49578920006752014
It is definitely aptly named.	Audiences are also introduced to a deleted character named Harold the Merman	0.15729986131191254
Ellen DeGeneres just steals the show as Dory.  	Ellen DeGeneres steals the show as Dory	0.9404656291007996
Is amazing how this was only Pixar's fourth film and they already were showing how good they are.	they make this movie amazing	0.495645672082901
This is the only 'Alice In Wonderland' that counts.	Deleted Song Silence is Golden Song Demo	0.49703341722488403
Johnny Depp is in it.	Crocodile Dundee in Los Angeles7	0.46441537141799927
They really did a good job with the 3d.  	It came even with the 3d  	0.19344131648540497
Wish they would put it back on the air.	It is a bit difficult to get filled with air we use an air pump and then have to finish it off by blowing it up ourselves	0.06620055437088013
This toy is a piece of garbage.	This is a Great toy	0.908649206161499
I still do not understand why disney does not come out with the whole show on dvd, but this film does fill that void and bit, and has the first two episodes of the show as a bonus feature.  	It holds all 13 episodes of Season one and bonus features such as interviews with the creaters of the show	0.528253972530365
Weird things happen, the main character moves on, and more weird things happen.  	This one will be a long term favorite.	0.07463134825229645
They wash fine, but they have a really cheap, slippery feel to them.  	They feel good but they almost feel slick to me	0.5226512551307678
***This review may contain spoilers***Many of you must remember the "Wonderful World of Disney" TV program in the '60's and '70s.  	I first saw it in the mid 70s when it was rereleased presumably because of the hippie movement of the late 60s	0.1843574494123459
You don't do bonus features this way.  	Parker's characterization qualifies as a middle-ground between the man as born and the man as memorialized by folklore.one of the best examples is in the form of Davy's tall-tales.	0.015206259675323963
Even posted a picture of the first waffle on Facebook.	This waffle maker is too cool	0.4910622835159302
First the acting and people in this film do a great job in  there roles and none of them try to over play there roles and make the movie centered around just one actor/actress.	The acting in this movie was great  Michelle Pfeiffer did a great job	0.543170154094696
Pooh is classic character and is one that people of all ages love.	This is one of the all time classics	0.6118384003639221
Gorgeous, full color puzzle with sturdy pieces to withstand many successful completions and a busy floor!	Very colorful and good size puzzle pieces for little hands and delivered on time	0.4663979411125183
Very Sebastian Cabot.	Theatrical TrailerG Preview Trailera	0
It would work very well for older children who love Tinker Bell, too!  	Its geared towards older kids	0.5683371424674988
And a few to go for Cars then I'm done.	Sam Rockwell  Bill Nighy Def Mos to name a few  	0.4801892042160034
Bongo is about a bear that was born in the circus, grew up in the circus and performed in the circus, but wanted a life outside of the circus.	Artists who contributed voiceovers here includeEdgar Bergen  Himself Charlie McCarthy and Mortimer SnerdLuana Patten  HerselfCliff Edwards  Jiminy CricketWalt DisneyJimmy MacDonald Mickey MouseClarence Nash  Donald DuckPinto Colvig  GoofyBilly Gilbert  The GiantAnita Gordon  Singing HarpDinah Shore  SingerNarrator of BongoBased on a Sinclair Lewis short story BONGO is about a bear cub that escapes from a circus for some adventures in the wild	0.4820396602153778
Both are better than the Mattel version.	I noticed that the colors in the bluray version are much brighter than what I was used to from the VHS version and I think this can be seen in the storyboard version as the colors seem to be darker in that version	0.26976320147514343
The first disc includes the first 3 episodes of Elfego Baca which is a fast paced "shoot em up" western series starring Robert Loggia (Frank from Scarface).	The first disc includes the first 3 episodes of Elfego Baca which is a fast paced shoot em up western series starring Robert Loggia Frank from Scarface	0.9758232831954956
Joaquin Phoenix is replaced by Patrick Dempsey, only a breath away from his big TV splash as TV as "McDreamy.	This movie is just as amazing as I remember from its original release  	0.4229373633861542
My grandchildren and I are able to watch this movie together.	My grandchildren really enjoying this movie	0.7081409692764282
but I was exhausted and frustrated by the time we got out.	and I was not disappointed	0.5004108548164368
Sweet Duck of Youth:  Scrooge and the boys head for Florida in search of the fabled Fountain of Youth.  A-24.  	Hotel Strangeduck deals with Scrooge and friends doing business at a rundown yet creepy hotel where its haunted then finally on Disc 1 is The Lost Crown of Genghis Khan where Scrooge with Launchpad and the kids go search for the title crown in Everest where they encounter the legendary snow beast	0.4506596028804779
It is a very nice size, about 7 inches, and seems very well made.	My daughter sleeps with him every night.	0.03684379905462265
Another great episode.  A43.  	An excellent followup episode  	0.3854023218154907
What a great film.	Unfortunately, everything was much smaller than we expected.  	0.03627770021557808
Watching it in 3D was like experiencing it for the first time.	I liked it the first time I saw it	0.584365725517273
It is long, boring, and not fun at all.	Has some genuinely funny moments but rather long and boring	0.2434053122997284
I love everything about this movie!  	I love this movie	0.45209696888923645
Tarzan is a wild movie and has been since I saw it first.	I think this puzzle is too easy for a child over 2.	0.06489241123199463
The next film is:Pirates of the Caribbean:	The movie was delivered quick and completely protected.	0.35927748680114746
It's still hugely entertaining, so it's little surprise that Disney would reunite MacArthur, Munro and Annakin	And its still funny  very much still relevant	0.34387022256851196
and I couldn't watch this.	I have not watched this and never will	0.35294368863105774
We kept ours up for an entire week.  	We all miss our childhoods	0.4244272708892822
yes, we use it all the time for this doll and other dolls that did not come with brush.	The other doll does not come with one7	0.6779261231422424
The detail, composition and color palette stand out in BD.	You learn what it was like to have your dad work for Disney.	0.08431295305490494
This product comes with the doctor bag and various medical equipment, including a stethoscope, "bandaid", and thermometer.	The items are cute with sparkles and approximate actual doctor tools  	0.41299277544021606
They were happy I bought it for our collection.	I bought this for my grandsons Toy Story collection  	0.46122750639915466
The quality is perfect and this movie never gets old.	Bluray quality is great and the movie is a classic  	0.6955549716949463
The film focuses on two particular monsters, Sully and Mike.  	The two films that are in this movie are Bongo and Mickey and the Beanstalk	0.540553629398346
The duck tub is better, we got this car tub to replace a holey duck.	Used these in the tub to transition from baby bathtub to bu tub	0.6884055733680725
Created in 1953, 27 years before I was born, I loved it when I was 5, when I was 20 and now at 33 I love it still.	I loved it when I was a kidand i still do	0.5175327658653259
This little guy is even cuter in person, than he appears online.  	Even more so in person	0.2962808310985565
It's worth it!	Definitely worth it	0.9258957505226135
Feel free to check out my blog which can be found on my profile page.	and I love the part when his father finally accepts him.	0.01987326145172119
Anyone else having problems playing the Special Features on the Blu-ray disc?	I saw another person on a different site complaining about the same problem on the DVD disk	0.4697723686695099
Lots of shows seem to break away from what they once were.	It may say waffle iron, but the resulting food does not have the nooks, crannies or crispness of waffles.	0.06255549937486649
This has been and always will be my favorite Disney movie.	Release and Reaction3.	0.21982808411121368
It was sold out here at the stores.	There online wherehouse was sold out	0.7250809073448181
The storyline is easy to follow, and makes finding Nemo a true adventure.	Adventure adventure adventure	0.058900386095047
It is just simply one of Disney's better movies.	This movie is just plain great  	0.47593048214912415
One of the top twenty American Films of the Nineties.	if there were 20 stars it would be 20 out of 20 it is that good	0.6168179512023926
I can't even begin to describe how beautiful the picture looks, but the reds are pure fire, the tea party is a kaleidoscope of every vibrant color you could dream of, the Rabbit's eyes are are a hypnotic magenta that I've never seen before because the standard definitions couldn't bold them enough.  	The colors are vibrant the picture clear	0.4469881057739258
Noisy, brash, contemptible, and saddled with a hero who is repulsive.	Alice is very curious and brave daring and bold but not obnoxious  	0.2596263587474823
LOVE this movie!  	Love this movie	0.4306880533695221
It's a good kids movie, not very good for a Pixar film.	A good movie 	0.28862521052360535
Unable to stop the fish-napping, Marlin embarks on a quest to rescue his son, evading sharks and exploding WWII mines and jellyfish and whales and hungry birds.	Some people will like this more than others - depending on personal tastes - but overall this is a great Disney classic and if you're a Disney fan, you'll want to check this out!	0.10472313314676285
I bought these for my 15-month old daughter who is starting to really love bracelets!	We bought this for a two year old who loves bangles bracelets and Minnie	0.48735272884368896
This is such a wonderful film for the entire family!  	This Blu-Ray transfer does justice to the animators work in te film.	0.03736734017729759
As well as they track pirate and island mythologies in this movie too.	This Pixar film wasnt too acclaimed as opposed to the other Pixar films such as Finding Nemo and The Incredibles	0.39424318075180054
