sentence_1	sentence_2	score
Was so worth ordering it for them at Christmas!  	Well worth it	0.6301072239875793
Two for the price of one!  	Cute set for the price	0.8416670560836792
so I ordered a little traveling potty as well.	I was wrong!	0.0380018949508667
The story begins in the early 1900s London, when Wendy, John and Michael Darling's father is exasperated because the boys are being affected by Wendy's stories about Peter Pan, who has become their hero.	Not 20 minutes into the film our heroine makes a very hard act of self sacrifice to save her father as opposed to fathers helping their daughters in other films if they are there at all and not long after that gets in trouble for her curiosity rather than her beauty which is usually what gets princesses into troubleHer relationship with the Beast doesnt exactly click from the get go	0.4363533556461334
This is a really great puzzle & my 3yr old daughter loves it.	I had gotten this for my 2 year old daughter because she loves Doc and is wonderful with puzzles	0.6088950634002686
and I thought it was a pretty good movie too for being full of Monsters it wasn't scary at all	I really just hated the entire experience and really felt bad that Sam Roclwell was so spot on and terrific and that his performance was wasted on a terrible film	0.5133421421051025
Some reviewers have said that the intros take away from the original version, but I think it is more about what you were used to, or were expecting to see.  	When the Tim Burton rendition of AIW with Johnny Depp was due out in 2010 I thought it might be a good time to go back and watch the benchmark Walt Disney production from 1951 which I saw or assumed I saw as a child	0.48264068365097046
I hope to see more of this.  	I hope this one fared better	0.5422244668006897
Sure, you might say, "But there are very few female racers in Nascar."	We gave this game to my daughter for her 5th birthday and she has played it almost daily since!Although she hasn't seen all of the princess movies, my daughter knows enough about their stories to correctly guess the princess from the picture on the card the majority of the time.	0.15787628293037415
It was one of the few Disney movies I hadn't seen yet.	Forget the new 2010 version!	0.009942793287336826
That's what I did with HIBUTK.Three-and-a-half stars.	A multi-part story so good, the creators do a commentary on it.  	0.08413350582122803
I was surprised to see  that it was originally released  by RKO studios.	I was completely surprised by this film	0.5267590284347534
The comedic flair of Monsters Inc. with Billy Crystal and John Goodman is sure to tickle your funny bone.	Still the movie sparkles with wit and humor	0.53041011095047
Tinker Bell comes to the rescue and saves Peter Pan.	With the help of his friends Tantor an elephant and Terk a gorilla they rescue Tarzan and Tarzan heads to the jungle to rescue the gorillas and save his family	0.628787636756897
The color is a bit distorted but still watchable.	A few minor quibbles one the aspect ratio while close isnt quite correct but it doesnt hurt the film there may be some color hues that are questionable though Im not going to even try to remember what this film looked like over 20 years ago	0.39238134026527405
This collection of stories was not as nice as "The Many Adventures of Winnie the Pooh".	Having Anne Hathaway and Julie Andrews return for the 2nd film made it so much FUN!  	0.04610826075077057
This is an excellent film with a top notch cast in excellent form.  	What a great film	0.6569949388504028
A great part of the movie and this is a great doll for any fan.	Kim Possible A Sitch in Time is perfect of any KP fan 	0.23558427393436432
I'll be waiting on a used one!  	Cannot wait for Finding Dory	0.4935241639614105
It is simply a fantasy adventure that makes no attempt to moralize and I love it.	Adventure adventure adventure	0.5749345421791077
A wonderful romp into the world of the monsters under our beds, and in our closets.	The monsters travel through doors linked to those in childrens bedrooms in our world and do their best to scare said kids into a nice shriek of terror	0.5247019529342651
I know that my nephew wanted this, but I feel that this does not seem that it is much product for the money.	My nephew loves this 	0.4405953884124756
He loves it and has watched it over and over again.	Another cute Winnie The Pooh And Pals movie for your Collection!  	0.12008783966302872
Maybe it will change if people buy this.  	Love it  buy it if you liked	0.4941686689853668
and I thought it was a pretty good movie too for being full of Monsters it wasn't scary at all	I thought it was too much of a girls movie and that I was forbidden to watch it	0.49422159790992737
I loved this as a kid!	The voice roles from Kelly Ripa(Live!	0.01927311345934868
I thought the high end was somewhat lacking.	My 4-year-old son loves Jake, so I was very excited about this gift.  	0.0959678366780281
I would recommend this comforter!	I would recommend these	0.9547252058982849
I can't say its true or not... only that the girl was not impressed.	This should have been climax of the entire series but Verbinski blew it by going the comedy route at exactly the wrong time.	0.08543742448091507
I recommend you do the first without, because the notes are distracting, and you may miss a punch line.	I recommend putting the subtitles on so that you dont miss any of the humorlol  Would recommend this to anyone	0.48306703567504883
A great plus is: it's all presented in an understandable format within the context of something that is simply good entertainment enjoyed by many of us.	For the most part however everyone takes it in good fun with the highly formal Jessie Annette Crosbie a case in point her husband bemused and she herself enjoying the experience greatly	0.4631587862968445
I don't do "spoilers", but I will say the movie is full of action and excitement, but doesn't showcase the kind of bloody special effects that have become the norm in film.	The special effects more than make up for the odd storyline in this film, but a fitting last film in the trilogy.  	0.4675317108631134
How can you not love Pixar's animated classic 'Cars'?	How can you not love a classic	0.8338061571121216
This set includes two Davy Crockett movies.	This two movie set was done by Walt Disney starring Fess Parker as Davy Crockett  	0.45326587557792664
This dvd came in very good condition.	This is a hilarious movie and the dvd came in very good condition	0.7425724267959595
In a war with Jason Shwartzman's Max for the heart of a teacher at Rushmore, a school, Murray shows a lighter dark side.	WARNING THIS CONTAINS SPOILERSI AM a teacher  	0.4440975487232208
Walt Disney Pictures did a fantastic job of editing the novel to make it suitable for children, as they have done with many of their motion pictures adapted from classic novels and fairy tales.	The smaller size has allowed my daughter to carry this animal around with her and it doesn't take up too much room in the tahoe when she brings it with her.  	0.12115490436553955
The one problem is that sellers on Amazon are selling this set for more than $25.	My husband channged out batteries and no change.	0.007782158441841602
I may be thirty, but you're never too old for Disney in my opinion.	It never gets old	0.6036199331283569
So I bought this when my son turned one and no longer fit in the infant tub.	I bought this for my son after he out grew his infant tub which didnt take long	0.6559342741966248
Stop, already.	I had to reorder another one with Mickey already	0
The sheets are very soft, almost a satiny feel.  	Plus the sheets and case are soooo soft	0.5038203597068787
This is definitely one of my favorite Disney movies.	Today this is one of my favorite movies  	0.7222548127174377
The Blu Ray transfer looks perfect and Disney has carried over all of the bonus material from the previous DVD edition with some new Blu Ray goodies too.	The Gold edition is the way to go for now as it looks very good considering and has some bonus material	0.6394161581993103
We have since picked up Chip n' Dale's Rescue Rangers and plan to start collecting these shows (TaleSpin, Goof Troop, Gummi Bears, and if I am very persuasive Darkwing Duck).	So Im making plans to woo and marry Belle  	0.416011780500412
So when I saw this on Amazon I added it to my cart right away & plan on giving it to her for her birthday.	I remember watching the GOTJ cartoon on Cartoon Network back in the 90s, and seeing the 1st George of the Jungle movie when I was 2 years old at the movies, it was the first film I saw in a theater	0.24564121663570404
His wings are difficult to click back into place (my 2 year old son can't do it and my 3 year old niece can't either)- His wings don't stay in place.  	Bought these for my 3 12 year old son	0.5619023442268372
The bluray DVD combo is fantastic.	I remember watching this movie with my family when I was a teen loved it then and now!!	0.12097658962011337
Items provided fun for story retelling time with the grandkids.	My grandkids loved it	0.11296391487121582
NEW this time is a somewhat interesting documentary "Growing Up With Nine Old Men" produced by Ted Thomas, the son of Disney animator Fred Thomas - one of the 9 artists who worked for Disney from the 1930s on.  	Deserving special attention are the recording of Never Smile At A Crocodile the actor imagined cut scenes and the documentary about the original animators who Walt Disney chose to work with him in creating his magic	0.5148091316223145
We get a music video for "Part of Your World" performed by Carly Rae Jespin.	Do not hesitate to buy this doll.	0.08688490837812424
This was before Christmas, so the purchase was a no-brainer..  	I was gonna buy it	0.6502442359924316
Comforter is lightweight (not too light).	Light fun but definitely not too light  	0.4005022943019867
I'm thoroughly enjoying it.	Thanks Im enjoying it	0.7368661165237427
but I was not yet ready to have him in a regular tup.	maybe but still a great Disney Channel Movie nonetheless	0.4705698788166046
My only complaint that has nothing to do with the actual product is that I could have probably gotten a better deal if I planned out my shopping better.  	The one I bought at the actual Disney store is made much better better quality etc	0.4744945466518402
Thank you for everything being as you said it would be.	Thank you Amazon for having it	0.4576427936553955
Colors are bright and beautiful.  	Very cute and in bright pretty colors	0.5266004204750061
Like Darkwing Duck, this show was a great combination of cartoon, comedy, and storytelling.	She loved the cartoon series	0.21350495517253876
This movie is sooo good.	It is a good movie	0.817520797252655
When the grandsons opened them up for Christmas, voila!	My kids  grandkids love them  	0.5530959367752075
He LOVES bath time now, and it keeps him nice and safe.	A soft place to land indeed.  	0.041857410222291946
An amazing transfer through and through.	Watches it over and over  	0.4338196814060211
It was always my favorite Disney Afternoon show.1-5.  Awakening:  The origin story, about how the Gargoyles lived in 994 AD, were betrayed by 2 of the humans they swore to protect, & were frozen in stone for 1,000 years.  	They were always my favorite 	0.438662588596344
I went online and found this and it's perfect.	The Fox and the Houndc	0.569357693195343
Now I feel like watching it again.	I enjoyed watching it again and visiting Neverland again	0.5489055514335632
He doesn't sound anything like the toy I have.	I recommend it for any girl of any age out there.	0.0594484880566597
The instructions say the outfits should be wiped clean only.  	They were just good clean fun  	0.3987269997596741
Don't miss out.	Dont miss out	0.8474917411804199
So combining my love for Pixar as well as the dozens and dozens of medicore Cars reviews I have heard, I decided to pretend this cheesy looking cash grab didn't exist.	I didnt heed other reviews because it seemed like such a good deal	0.42422711849212646
CLOUDY WITH A CHANCE OF MEATBALLS---the son of a shopkeeper is an inventor whose inventions cause havoc.	I paid a little under $12 through amazon.  	0.045107513666152954
but I will very soon	It is a great pirate adventure.	0.08602490276098251
For me, the box is insanely cheap.	2 the box she came in wreaks or smells of nasty cheap glue due to cheap tape  	0.34187766909599304
Read them as a kid 55 yrs.	I think its perfect for 35 year olds	0.3369378447532654
We bought this for our 2 year old who loves to help Mommy clean.	We bought this for a two year old who loves bangles bracelets and Minnie	0.7635949850082397
There are days when you just need to watch something silly and this is the one to watch.  	You have to just watch it	0.503487765789032
A must own for lovers of cartoon animation.	Great for young childrenGreat animation	0.27896198630332947
There's no longer the wonderful "Will they get together?"	STILL AS AWESOME AS IT WAS WHEN I WAS A CHILDTotally fabulous	0.4985852837562561
STILL the best Beowulf movie made so far!  	The very best Peter Pan ever made for film	0.7709599137306213
Miyazaki always makes the best in story, animation and message.  	The animation and story is top notch	0.5836120843887329
AGRANDAR LA IMAGEN Y UN	Definitely a great movie.	0
I would recommend any new parents to have one, it is safe & babies have lots of fun.	The lossless soundtrack is dialogue driven and dialogue is crystal clear.	0.03950732946395874
The plastic on the front was dented it, but the puzzle was unharmed, unsure how that happened in shipment.	We like having the Blu-ray / DVD combo to be able to use the Blu-ray at home and take the DVD with us on trips.  	0.07501442730426788
Conclusion: Pixar's path to supremacy is lined with some of the finer examples of the genre.	Not only is the picture much more colorful and the image has been respectfully cleaned up, but the 3d was very good also!	0.09515531361103058
,,, a not slippery bottom and a drainer!?!?	The only thing I dont like the bottom is very slippery	0.6525626182556152
No scratches or fake/replica codes.	Keenen Ivory Wayans or Jada Pinketts	0.5400020480155945
I was gonna buy it	Should you buy it  	0.7686474919319153
This is such a hoot!	He is so funny  	0.3599695563316345
loves this lunch box and the puzzel inside.	Frozen lunch box 1000  Your granddaughters face as she proudly marches in to preschool with her new lunch box	0.5390405654907227
Little girl will melt your hearts.	You should all be proud of yourselves for breaking many young hearts	0.22879615426063538
In the winter I can add in a fleece blanket, which I'd probably do anyway.	My 3yearold doesnt fit on the mat and the blanket doesnt cover him sufficiently  	0.1815072000026703
The size is perfect for a regular size bath tub!	Its just the right size and works great for her baths	0.6760236024856567
The remainder of this rating is for Amazon..	Click on See all my reviews for the lowdown on other 3Ds	0.47895875573158264
no, really?  	I dont really like	0
They both make the movie dark, and neither get punished.	Little guy and I both love this movie	0.6606875658035278
Cute assortment of clothes - easy for my girls 2.5 yrs old to take on and off.	Got this for my 25 year old  	0.3229479193687439
It's definitely still a crowd-pleaser.	This may not be the best Disney animated film, but it is a worthy entry in the on going Disney animation cannon and should not be passed over.	0.06286047399044037
At first she was disappointed he wasn't the same one they have @ the character meet in Disney World but then decided he was better since he could ride her shoulder just like Rapunzel.	But hes 3 so he honestly didnt piece together who the characters were so Im slightly kicking myself for waisting the money on the characters  	0.4207521975040436
yet he did, gratefully.	Im glad it did  	0.03158901259303093
thank you to the seller for a grand overall experience in all areas.	I had a good experience with this seller 	0.5964033603668213
The second feature on disc two is Disneyland 10th Anniversary which is a pretty cool treat with a look at the "new" attractions Walt and his crew were coming up with.	It means that I will most likely watch it on more than just the initial occasion.	0.17253823578357697
The bonus materials, besides an interesting "Making of" documentary, include a short animated gem: "The Little Matchgirl", based on the story by Hans Christian Andersen, one of the saddest penned by this rather gloomy spinner of tales, both beautifully and faithfully transcribed to film, in 2006, by Disney's Roger Allers and Don Hahn.	Adapted from the brilliant story by Lewis Carroll but with classic colorful Disney animation and both fun and endearing songs this version keeps to its literary roots and entertains  	0.4925707280635834
If you're worried about it, buy directly from Disney.	It combined dress-up with Princesses -- two of her favorite things.	0.0012099527521058917
Prince of what?	firstAnd what of Wigands fate	0.2830885946750641
It's beautiful and I highly recommend it!!!	I recommend it very highly	0.7991607189178467
Movies don't keep his attention as well as PBS shows like Super Why!	However  not liking Pinocchio is akin to not liking youself  	0.3623755872249603
I searched for Bambi DVD, and purchased one of the first items listed (not realizing it was an outdated VHS).  	I would not of purchased this had I known  	0.43266400694847107
I am pleased with this Mickey Mouse egg ring.  	I am happy with it	0.5900453925132751
Well on a positive note, its cute and the Minnie graphics are great, BUT......I Just got this for one of my 2 year old twins.	My 2 year old can use it as a pillow very cute 	0.49230891466140747
But believe it or not, the signs of their eventual downfall from grace wasn't marked by either Cars nor Wall-E; if anything, Finding Nemo pretty much confirmed for me that the studio was heading into a really bad direction.	I'd much rather read a book than watch a movie.  	0.19789469242095947
A multi-part story so good, the creators do a commentary on it.  	Good story	0.48705926537513733
The sheriff was even better in person, the picture did not do it justice.	It's TaleSpin!	0
Im not sure whether to recommend this product or not!	Highly recommend this product	0.730116605758667
I bought it for Christmas.  	but I bought it	0.7508841753005981
Helen Mirren is a classy actor, and the rest of the cast super.	He becomes a success as an actor a star	0.26417216658592224
what can you say about Disney movies.	Great rendition of the Tarzan movies	0.03666048124432564
I recommend you do the first without, because the notes are distracting, and you may miss a punch line.	I recommend skipping  youre not missing out	0.4240572452545166
Having come of age when the book was popular I enjoyed it being made into a movie.	I really enjoyed the movie  	0.33351460099220276
the only negative is how large McQueen is once on the bed mostly just his face is visible, not the full car which is the only reason I didn't rate a 5 star.	The only negative I would say is that this version is not a complete one	0.5486512184143066
You will literally find glitter all over your house and even on yourself when you didn't even touch it!	Dont even think about it	0.38064584136009216
When he is tired and sleepy, all I have to do is play this DVD for him and he is soon asleep:)	I don't really remember the other one.	0.02278059907257557
We have the other princess dolls and my daughter loves them, so she got this one for Christmas and really loves it (She's 3 1/2).	My daughter loves this doll so much	0.6924002170562744
I gave this movie two stars, though, because I thought the calendar was very tastefully done.  	I gave it 4 stars just because I dont think its absolutely amazing but its a good film generally	0.33636224269866943
Trample Off, Eh? Game	Theatrical TrailerG Preview Trailera	0
This movie is on our "Classic" list.	Definitely recommend if your kids like Rapunzel!	0.012647741474211216
THE DRESS IS LOVELY!	Theatrical TrailerG Preview Trailera	0
some hilarious moments involving an overzealous chef and our friendly crab	Like the other Disney slapstick comedies about Medfield College The Strongest Man in the World offers some hilarious scenes set in a goofy and enjoyable story line  	0.4423774778842926
I don't usually cry when I see this scene, but it touches me having lost my father at a point in my life.	I personally never saw the fascination with this film and viewing the Blu Ray was probably only my third or forth time seeing it in my lifetime	0.3654344081878662
"Alice in Wonderland" looks great in this Blu-ray 60th Anniversary Special Edition.  	She looks beautiful in it	0.5938675403594971
Love the previous Pixar movie references.	AND i also got an $8 coupon for Peter Pan and pre-ordered it.	0.03455311805009842
Last Train to Cashville: Investigating a little boy's missing train set, the Rangers track it to yet another of Fat Cat's robbery schemes.  	Catteries not Included When the Rangers investigate the case of a little girls missing cat they discover a scheme by the nefarious Professor Nimnul  	0.40806078910827637
Unfortunately, when we blew up the jet pack the day before Halloween and my grandson wore it for about an hour, it began to deflate quickly.  	Our grandson became a Cars fanatic shortly before his 4th birthday and weve been collecting them ever since  	0.5436388850212097
great family movie and continue on with the Priates of the caribbean movie.	Great family movie and great 3D	0.5969682335853577
So when I saw this on Amazon I added it to my cart right away & plan on giving it to her for her birthday.	I bought this for my daughter after taking her to go see Wreck it Ralph	0.5381514430046082
Jiminy Cricket is also a fun sidekick character.	His characterization is silkily evil but he is also able to play the more comical side of the character	0.3746775984764099
And it's al thanks to "Cars"!	Theres also the question of whether what NBC et al did was wrong	0.4253406524658203
There wasn't that much singing (for a Disney movie), and it was mostly just swimming... and swimming... and swimming.	Things going bad at work it hits you Just keep swimming swimming swimming  	0.033851996064186096
Monsters University is a look at the relationship between Mike and Sulley during their days at Monsters University -- when they weren't necessarily the best of friends in this sort of prequel to Monsters INC.I thought the original Monsters INC movie was one of the better animations movies going, with a good funny story that made me as an adult laugh.  	My Granddaughter loved the movie.  	0.13979466259479523
I'm sold on it now.	There online wherehouse was sold out	0.5836995244026184
Part of the problem lies in the fact that the original novel featured a unique style for its fantasy world from its artwork to its original story.  	What a funny movie with a twist of Drama and Special Friendship.	0.07628712058067322
But is very realistic and soft all over!	And it is very very soft  	0.6372029185295105
Cute kid movie I've never see before and it was very cute.	I never saw this movie before recently	0.6017298102378845
The picture is so pure, so clean, so detailed that you will see much more that you ever had before.	I was so surprised to be able to see this movie so much more clearly in blu ray  	0.4379110336303711
When perfect rich creatures have cake they receive a thin wedge and eat primly and perfectly and moderately with utmost control?  	They have a shiny and smooth texture and are completely nonabsorbent  	0.49701929092407227
I love film - no matter how old these charming stars become, they will be forever young and empowered to do it right for us for a long long time!  	Nine years old already this one manages to push all of the right buttons of what a CG feature film could and should be while managing to appeal to viewers of all ages	0.44430044293403625
A must own for all (except impressionable little children), 5 stars!	But its 5 stars for a DVD	0.38394036889076233
Reinventing the Submarine Voyage* Deleted Scene: Alt Opening* A Lesson in Flashbacks* Knick Knack Theatrical Short* Aquarium* Finding Nemo - A Filmmakers' Roundtable* Selection of Virtual Aquariums* Art Review* Documentary: Making Nemo*	Filmed in the Bahamas	0.8049025535583496
(which can be seen as one of the books in the opening of "Pinocchio")	If you can read the books first	0.5137069225311279
It's nice to see such a wonderful actor like Stewart getting involved in more family friendly film endeavors.  	This will never be called a great movie but it is a good family friendly romp	0.5681413412094116
I now have another grandaughter, aged 6 months, so I have an excuse to buy another copy.  	Gave these  to a 6 year old for Christmas thinking they were sturdy enough for a kid to play with, within hours the cheap plastic planes were starting to break with normal playtime use.  	0.26096010208129883
Do they have an old wise woman/man?	Animation wise all I have to say is this is Pixar	0.5135615468025208
I think the storyline and plot are interesting and find the characters very likeable.	Fun characters and good plot  	0.6897879838943481
Buy this movie for its charm, its humor, its compelling story, and its heartfelt message; that you're braver than you believe, that you're stronger than you seem, and that you're smarter than you think.	Of course it is all a misunderstanding and there are laughs music and braverybeautiful scenery and a good story with a gentle messageyou are stronger smarter  and braver than you think  	0.5075685381889343
Wish they would put it back on the air.	I watched this show when it was on the air  	0.13568700850009918
Unfortunately every one of them has Woody and Buzz.  	Each set always comes with each of them  	0.5991641879081726
If you haven't seen this, see it.	So I saw this and got it	0.5242003202438354
