sentence_1	sentence_2	score
Even my old VCR  from 1980 could fast-search....  	Im getting old	0.4126332700252533
Considering this is a Disney classic the prices can be outrageously high, but I come to my surprise this was not.	There is very little they have changed in the movie itself.	0.0572044737637043
I watched it and it was a blast.	My grandsun watched it and loved it	0.7367583513259888
I was huffing and puffing when it was all done.	Three Men and a Baby had been done  	0.5667193531990051
Overall, I highly recommend this movie to Disney Fans all over the world!	If you are looking for some Disney humor for your kids or grandkids (or those that are kids at heart --- like me) then this is a good purchase with 8 episodes on each of the three DVDs.	0.10165926069021225
My 3 1/2 year old daughter adores this set.  	Got this for my 3 12 year old son at Christmas  	0.4754981994628906
I really enjoyed watching this movie on Blu-ray.	I really enjoyed this movie  	0.8263476490974426
Some may appreciate the lack of focus and the dreamlike quality, which I can fully understand.	Were not very happy with the quality  	0.17712010443210602
She falls downs a rabbit hole and arrives at a wonderland.	No way is it "used-very good."	0.12505638599395752
5 stars, period.	5 stars	0.6596382260322571
All I can say is that it was like this movie had been made just yesterday specifically for the 3D format.  	Wishing it had been the right DVD cause I do love this movie	0.5687496066093445
The new transfer is natural and film-like in its texture.	The 1080p transfer is Amazing  	0.49186426401138306
Love Phineas & Ferb, love Perry.just had to get this for the kids.	My kids love Special Agent Ozo	0.26652657985687256
Plus, I love this movie because the Prince isn't just a figure, he is actually a character in this one.	This stays together for hours of rough boy car-smashing, flying, imagination play.	0.06635534018278122
The movie does a fine job of sticking close to the plot but something is missing in the translation.  	It is larger than standard hot wheels cars, but is perfect for toddlers imo...	0.12328623980283737
The Beast is particularly amazing.	It is amazing	0.2733232378959656
It's worth it!	Its worth it	0.9258957505226135
Against the odds, HIBUTK works, and is even affecting.  	but I would not buy it for someone who knows the difference or wants to hold to the doll for a long while or as a memories or play a lot with it becuase this doll just does not do the job.	0.14994576573371887
For material that does not lend itself very easily to cinema, this is a good adaptation of "Alice in Wonderland" with some enjoyable characters and sequences.	Deffinatly for those that enjoy a fairly simple plot with lots of great costumes and fun characters  	0.5320899486541748
but then it continues so therefore its ok	Thats why Disney continues to do it	0.4823993742465973
She's seen most of the movies, so that was a big help, but regardless her memory is amazing--we parents don't always give our children enough credit!With each successful guess, the player is given one to three jewels to place in a ring, bracelet, or crown.	The game ends when any player has their tiara bracelet and ring filled with the sparkling gems	0.2733395993709564
Another solid collection.	Just part of the collection	0.089325450360775
Just as good now as it was when I was a kid!	Watched it when I was a kid	0.5432283282279968
How can you not love this?  	Whats not to love	0.7650704979896545
We've only had the second Buzz for three months and it has begun, his left foot has broken off and my son is so sad.	We have had it for 3 months and his arm just broke off  	0.673549473285675
Keenan Ivory Wayans did a great job with this movie, and Jada Pinkett was too funny!	Disney really did an excellent job with this film	0.5808215737342834
Goodness, what a horrible loss!  	So is Alice a loss	0.08909399062395096
I was very dissapointed to get only a doll.	It was an okay doll  	0.26264142990112305
My daughter has been happily playing with these for over a month, and no pieces have broken off or are missing, and she's dropped them countless times onto our hardwood floor.  	This is a nice set with some nice details  the girls have been playing with them for the past week or so on and off again	0.5226464867591858
A little of this goes on far too long and ceases to be a source of amusement.  	But the 2D disc is nothing less than impressive.	0.1433868557214737
Marlin will have his slightly antagonistic encounter with their parents who try to reassure this overprotective father of a physically challenged child to give him some independance.	Strangely it somehow delivers an edict addressing overprotective parents who wont give their children room to grow on their own	0.5748956799507141
I remember running home from school as a kid waiting for this to come on.	I remember watching this show after school as a kid  	0.5628378391265869
But one that helps understand what happened to Alice is the part before she followed the White Rabbit down the rabbit hole.	A girl falling down a rabbit hole and suddenly shes biglittlebig	0.35580530762672424
Daughter just loves them!	Grandaughter loves them all	0.6975953578948975
My favorite character is Jack Bristow.  	Dora is my favorite character	0.9222368597984314
The concept of a mermaid princess is interesting to her, since the other princesses she adores are land lubbers.	They love the stories about princesses	0.6305349469184875
I love Mos Def!!!	We have returned to the fully shaded, detailed art work, and only the insufferable Gaston is angular in style.	0.02073896862566471
The Little Mermaid is one of our favorites and we enjoyed the movies as a family!	Disney movies are a favorite in our family	0.5954608917236328
I will be getting the other seasons as they are such a great price.	Disney had an affinity for Alice novels going back to his initial years in the industry with Alice and Cartoonland.	0.08659231662750244
Ive seen some of it but not all of it.	We watched the Muppet Show on TV and loved the show.	0.07124010473489761
I am suprised that none of them have broke yet.	I dont have a 3D TV yet so I cant comment on that yet although my friend does have one	0.3723090887069702
They come in handy when 'sharing' Jake toys for extras or if some have been lost from a previous set.	The Blu Ray transfer looks perfect and Disney has carried over all of the bonus material from the previous DVD edition with some new Blu Ray goodies too	0.4747038781642914
Finding Nemo takes its viewers along on the offbeat voyage of an overprotective clownfish father, Marlin (Albert Brooks), as he attempts to locate his lost (abducted) son, Nemo (Alexander Gould).	But he can swim OK and his overprotective father gets on his nerves	0.4194606840610504
They just don't make them like they used to :)	my son loves toy story and was very excited to see them but doesnt like how small they are and that they dont come with something to put them in so he doesnt lose them	0.41774773597717285
We had been looking for this DVD as one of the younger members of the family REALLY wanted it!  	Easy to build and fun to play with.	0.12423904240131378
Yet another Disney Classic finally available on Blu-ray.	And I finally gave up	0.5962719321250916
One of Disney's greatest animated features presented in stunning high definition and awesome 7.1 sound.  	The 71 DTS HD soundtrack comes alive during the major songs and setpieces namely the bombastic Under The Sea	0.3791061341762543
He still had all the best lines and he was still the only person who really got anything done in this or knew what they were doing.	Audiences felt it and still do	0.4203680157661438
THIS IS AN AWESOME MOVIE FOR THE WHOLE FAMILY TO ENJOY TOGETHER THE PACKAGING AND THE CONDITION OF THE DISCS WAS PRETTY CLOSE AS DESCRIBED	Theatrical TrailerG Preview Trailera	0
My husband loves this movie so when it re-released in 3D I had to get it for him...he now loves it more.	She loves it	0.7039856314659119
I love Blu ray and so do my grandkids.	I know my children loved it  now my grandchildren love it too	0.3676368296146393
The first movie worked partly because Anne Hathaway's character and her friends were young, smart, somewhat hip San Franciscans who thought the whole idea of royalty was a bit silly.	He had quite a minor role in the first place	0.47882211208343506
and I would buy again.	Probably would buy it again	0.7504584789276123
I searched for Bambi DVD, and purchased one of the first items listed (not realizing it was an outdated VHS).  	I had looked at so many before I bought it I must have not looked or it wasnt posted	0.40728798508644104
My younger family members love it, my cousin can't stop watching it.	Every Halloween my family and I watch Halloween Town	0.45399439334869385
I ordered this for a 4 year old boy and he loves playing with it.	I would definitely get it again.	0.023279421031475067
"Much Do About Scrooge" has an annoying salesman who goes with Scrooge and the boys to an island where Shakespeare has a lost book that wasn't published.	It started off well rolled into a tedious bore of a ride and ended pathetically in a who cares way	0.42839890718460083
It is pretty tough too.  	Ok, so the fins are great.  	0.14325332641601562
A favorite of my daughter's family, this movie holds the attention of two grandkids,their parents and the granparents.	One of my families favorite Disney movies	0.5128720998764038
Taste in movies is highly subjective.  	Disney films are largely free of sentimentality	0.5273116827011108
Buffy was kind of annoying, but this was still a fine episode overall.  	I think his idea to combine the stories "Alice In Wonderland" and 'Through The Looking Glass" into one film was a perfect idea, and many Disney fans like myself consider it his best film.	0.048842184245586395
but this was very inexpensive and will do the job for dress up.	I bought this awhile ago summer time for Christmas my daughter opens it today and the dress is tornThe doll is in good condition and I can easily sew the dress but not really something I should have to do right out of the box	0.40109920501708984
Walt Disney managed to produce the most memorable true life adventures, cartoons (animated features now), and several Historical features such as the legend of Davy Crockett.  	Gorgeous animation colorful and memorable characters and a great storyThe Ocean is illustrated as a beautiful but very scary place in this wonderful animated film	0.49501973390579224
Seriously, does a full horn section have to start blaring every time Peter Pan leans on a wall?.There are a few bright musical moments, though ('You can fly', is pretty enchanting).	The MTV Movie Awards Shorts are brief three segments each about a minute long and a thirty second introduction but are just fantastic	0.35668933391571045
The seams held up well with my 6 year old and her 3 year old brother, even though he is floppy, just like the movie would imply.  	Bought it for my 3 year old	0.6681655049324036
It was worth every second I spent watching it over and over again.	They watched it over  over again  	0.5987026691436768
Jiminy Cricket is also a fun sidekick character.	Jimmy is a funny guy	0.5350861549377441
Nemo becomes separated from Marlin in the Great Barrier Reef, when Nemo is unexpectedly taken far from his ocean home, and dumped into a fishtank in a dentist's office.	But once when little Nemo and his friends venture out too far and Nemo is rebuked by his father he draws further away from his Dad resulting in his being fishnapped  by a diver named Phillip Sherman Bill Hunterwho will keep him in his dentists office aquarium near Sydney Harbor resulting in Marlin beginning an odyssey of his own to retrieve his sona journey on which he will be greatly tested	0.45646071434020996
Having said that, I would have rather paid twice as much to have the figures move more and for them to be a larger size.	I do wish that it came in a larger size though	0.4468572735786438
If you haven't seen this movie, you should buy it.	If youve not seen this movie you need to put it on your list  	0.42678871750831604
Gore Verbinski is the opposite of that, he needs to learn how to edit things down.)	You learn what it was like to have your dad work for Disney	0.39762774109840393
It's addicting because each episode leaves you hanging so you HAVE to watch the next one...as soon as you know it, it's really late and you're supposed to be up early for work.	It is addictive to watch these because you can literally watch one after another and before you know it youve watched 3 or 4  	0.4903714954853058
All disney's remasterized versions of their movies are absolutely outstanding	You get all 3 versions of the movie	0.5959098935127258
Of course it could be argued that none were near as successful at delivering such a simple prose laced with such complex emotions.	The movie moves away from the book at some points(as movies must) but, still keeps the feeling of the story as well as the time and place where the story is set.	0.0791436955332756
One of the best things about Tarzan is his innocence, his relationship with is friends and family are tested and he chose them.	Poohs Grand Adventure is the latest Disney DVD featuring Pooh and his friends at the 100Acre Wood	0.48119810223579407
Watch over & over again.	Filmed in the Bahamas.	0.024312280118465424
My favourite character has always been Spinelli, and I just missed her for some reason, even though she was there as much as anyone else.	He has also since become my favorite Disney character though I prefer Mickey Mouse	0.4839254915714264
the inevitable usual result is that people who were supposed to of actually existed tended to feel cold and wooden enough to of sprung from the very basest form of fiction.in a curous way, though, that what salvages the films in which Fess Parker portrayed Davy Crockett.	But Mia was alrihgt with that aside from the fact that she starts to secretly swoon for her rival for the throne and all Lily seems to care about is all of the fancy stuff that she got to have by being the friend of Mia the real Lily would have jumped onto her soap bow and told how it was unfair that the royalty of Genovia lived a life of decadence while there were people who were starving to death and they it was stupid that Mia was expected to follow this Medevial rule when women proved that they could rule on their own	0.46282804012298584
After an unfortunate accident with Elisa and her handgun, Broadway goes on a streak of vengeance against someone he sees selling the stolen guns.  	Here Ursula is evil with a personal vendetta against Triton and she sees Ariel as a good chance to lash out at him	0.626295268535614
They're a bit harder to lock back into place but they do stay locked in and don't randomly extend.	Our daughter could barely fit this on and the teeny velcro in the back wouldnt stay shut when she bent over  	0.41343724727630615
When you pay for a Blue Ray you should get the best.  	If you want it you should get that one as well	0.5486840009689331
I enjoy the musicas well as the story..  	I love the story	0.2710683345794678
We have since picked up Chip n' Dale's Rescue Rangers and plan to start collecting these shows (TaleSpin, Goof Troop, Gummi Bears, and if I am very persuasive Darkwing Duck).	I recently started collecting Disney DVDs and was thrilled to add this one to my collection at such a great price	0.41262170672416687
However it doesn't seem to have much else artistically or stylistically going for it.	And for the first time in a film it didnt seem cheap or trite or whatever it felt real to me at least and my own twisted up world view but that doesnt matter	0.4121675193309784
The musical score coupled with the subtlety of genius and talent are what we take away from this movie.  	The musical score is also in of itself brilliant  	0.5769516229629517
Naturally, he's finally made to see the error of his ways and has an instant (and totally unbelievable) change of heart.  	Its the same plot again and again and again a kid is an outsider in his society he is ridiculed he makes major mistakes his parents cant relate to him especially his father but he has a certain ability and he ends up saving his townvillageworldfamily from certain destruction at which point everyone realizes hes just great and the feel bad about having demeaned him in the past	0.41054266691207886
My husband channged out batteries and no change.	We dont like noise so we never put in any batteries in the hair dryer  	0.45826253294944763
He has no idea who she is at all.	I had no idea she would love it as much as she has	0.4712964594364166
The musical score coupled with the subtlety of genius and talent are what we take away from this movie.  	Maybe thats the genius behind this movie	0.3872370421886444
Granny is going to get a glue gun and sparkles to add to the tiaras plus a rose for the belle.	Enjoyed watching it.  	0.01848759315907955
They took a chance having someone other than John Lasseter helm this one—and it paid off big time.	This Blu-ray version of Pinocchio is in a "DVD package" meaning, it is in the black case that most DVDs come in, BUT IT CONTAINS THE SAME 3 DISKS as the "Blu-ray Packaging" version!It includes...Disk 1: BLU RAY VERSION of Pinocchio!Disk 2: BLU RAY "BONUS FEATURES" (including "No Strings Attached: The Making of Pinocchio" documentary in HIGH DEFINITION!Disk 3: regular "DVD" version of Pinocchio (which makes a good back-up, or one the kids can use while you store the more valuable Blu-ray version in a safer place.	0.08903800696134567
In fact, I kind of disliked it.	I really liked it though	0.39786428213119507
This is one film in which Pacino's "over the top" brand of acting is appropriate.  	It's a lot bigger than I expected (assumed slightly larger than beanie baby size) and she loves it!  	0.10522907972335815
Highly recommended to all Disney fans!	HIGHLY recommended for fans of old TV Disney fans Fess Parker fans or anyone who like semihistorical TV	0.4276461601257324
Of course "Nemo" was so worth the wait (love the movie).	Of course I loved this movie	0.28079578280448914
Disney was always a step ahead of the game.	I found this to be a fun little Princess game I thought it might simply be a Princess version of the Pretty Pretty Princess game  	0.1806253045797348
colors are so vivid and beautiful.	The colors are nice and bright	0.6626074910163879
Obviously, it being a Disney film, there are millions of people who love it, so take what I say with a grain of salt... just look at the hundreds of "five star" reviews that surround mine.  	And considering that over 800 people made reviews of this movie and how barely a handful of them are onestar reviews the others clearly know what theyre saying when they claim this movie rocks the house	0.4187537133693695
I love kim possible show that why I miss all the show so I have to get it on DVD.	But I still love this show  	0.5703189969062805
Don't waste your money, especially these marked up prices!UpdateI contacted the company and they offered to ship me a new one right away.  	I wouldnt waste my money on these again	0.24786485731601715
Its hard to believe this series is over 30 years old.  	Not sure if this happens a lot or not but for a 30 toy it needs to be a little more sturdy	0.3339973986148834
They found it interesting and fun for about 20 minutes, then they didn't want to play anymore.	The last 20 minutes	0.2645289897918701
After about 10 minutes of trying to pull her out of the box (a pet peeve but not taking any stars away for it)	My only complaint about the doll is her hairits a little crazy which I know Meridas hair is in the movie but when she comes out of the box its perfect waves of curly and after about 10 mins of play its all over and my daughter keeps wanting to comb it nice again but	0.4785397946834564
It was gone just as soon as I'd seen it.	Just as good now as it was when I was a kid	0.4767168164253235
You can watch an episode from the first season and then one from the last and the characters and writing just seem completely and utterly different.	Alices Adventures are episodic and disjointed she goes from one encounter to the next and there doesnt seem to be any real point to the story except the aforementioned be careful what you wish for	0.48177242279052734
Dreamworks now rivals Disney when it comes to animated comedies; think Shrek, Over the Hedge and How to Train Your Dragon.  	The player is close to the size of an adult's CD player.  	0.06254228949546814
Their relationship has always held a special place in my heart.	I don't know that I ever realized it before...	0.10372588783502579
I decided to replace my old dvd with the new blu-ray version of this movie.  	Being I have never had the dvd disc to this movie just the vhs copy which by the way held up extremely well I look forward to the new diamond edition with extras	0.5649697780609131
After "Toy Story," this movie is my favorite of Pixar's work.  	Today this is one of my favorite movies  	0.7709677219390869
Also, a big kudos to the characters in this film.	Very realistic to the character in the film	0.3519342541694641
Trample Off, Eh? Game	YO LA VERDAD PRESIENTO QUE	0
And unlike most series of the era, it still plays well today.	Hopefully we won't have to wait nearly as long Season 3 (whether the writer considers the episodes cannon or not).	0.14723019301891327
I let a family memeber hold it last summer and I haven't gotten it back since, and it's almost Thanksgiving.	The 70s brought only semi-successful films, and the 80s were a very rough time for the company.	0.12346917390823364
There was a 4 year gap between the release of season 1 and part 1 of season 2, and a 10 year gap between season 2 part one and season 2 part 2.	I now own season 1  2 and will soon be adding the 3rd season to my must buy list	0.5824682712554932
As good as I remember!  	Better than I remember this is a good buy for someone a little more seasoned who remembers how cute and simple cartoons used to be	0.20871764421463013
I certainly can see what draws so many people, young and old, deeper and deeper into its underwater adventure.	It is a bit longer than a baby tub and is definitely deeper	0.516278862953186
Without waiting for me to send my copy back, that's service!	It must have been a challenge to portray such a well-known face and he did a very good job.	0.038020167499780655
I grew up on all the old Disney movies, loving every one of them.  	We had all of these movies VHS	0.27489542961120605
Love love love!	I love Finding Nemo  	1.0
Its great for 18 months up	I ordered the Pooh one of this potty and my 18 month old daughter loves it	0.5056957006454468
Watch it with my grandkids and they really enjoyed it as myself and my wife.	I have seen this movie with my grandchildren and we loved it	0.6407246589660645
Not a great message to children.	Its Oliver Twist Or The Parish Boys Progress for kids	0.0997367724776268
this movie is about 6 years later then the first movie.  	Enough about the movie  	0.46700218319892883
*** There's an adorable field mouse drawn in a completely realistic fashion.	as a big fan of the muppets for many years, it was great to find such a good price on a classic	0.1811143159866333
Bought digital copy.	Blu Ray Blu Ray 3D DVD  digital copy	0.8608413338661194
Go check this out!God bless you all.	especially like them rockin the boat.	0.05422646924853325
My son is 23 months old and is obsessed with this movie, we have actually rented this a few times because he points at the tv and says raaaawwwrrrr, we will be ordering the DVD for his birthday.	this movie is 23 yrs old  	0.46493518352508545
One of my female friends was moderately depressed over the season ending for History Channels' "The Vikings" .So	The ending of the film was an are you serious kind of ending	0.4270235598087311
I recalled the days when we had to wait for reruns to watch the Disney classics.	It combined dress-up with Princesses -- two of her favorite things.	0.06375838071107864
With the Criterion re-release, I expect this version of the film is now out of print.  	As with the previous platinum DVD release you have three versions of the film to choose the theatrical 1991 version the extended 2002 version which is the version I prefer because Human Again is a fantastic number and the Work in Progress version	0.5220966339111328
DVD ia Good condition!	It was in great condition	0.01734994724392891
Use your telephones to control the game.	The game is played using your remote	0.2251155823469162
They love it!	I'm a little confused.  	0.004688007291406393
my foster sons have enjoyed these toys.	This was a Christmas present for my son and it is one of his favorite toys	0.33378055691719055
Snow White and the Seven Dwarfs took Walt Disney and his studio from short subjects into the much more prestigious world of feature films.	I have grown to love Wes Anderson and his films all somewhat surrealistic and more than obviously inspired by both New Hollywood films of the sixties and also the artistic and cinematography of French New Wave films like Breathless Pierot Le Fou and Jules et Jimreferenced slightly in the Life Aquatic Not This One	0.3250828981399536
if ihad teenage grandkids they wud love it too.	My kids  grandkids love them  	0.7207996249198914
I had to get the blu ray version, as I was sure they would improve the colors and sound, and boy, I was right.	Watching this movie brings back good memories; hence, that is the reason I gave it such a high rating.	0.01792599819600582
It's a very nice coming of age movie.	Super cute movie that anyone of any age can enjoy  	0.5414751768112183
It seems very good quality!	I can still remember the plot and the characters, GENIUS!!	0.00561132375150919
this movie is about 6 years later then the first movie.  	Love the movie	0.44137126207351685
