sentence_1	sentence_2	score
India Ink: Image of the Day: January 16	Two people walking along the shore at sunset.	0.067682646214962
7 killed by Shiite al-Houthi fighters in northern Yemen	Palestinians 12 killed in IDF strike in northern Strip	0.6162045001983643
In afternoon trading, Aspen's shares were off 89 cents or more than 27 percent at $2.33 per share.	Oracle shares fell 27 cents or 2 percent to 1309	0.7507196068763733
Queen meets Britain's new baby prince	The new Cold War	0.49258121848106384
And until they decide that, "the statute is presumed constitutional."	A law is constitutional if it does not conflict with the Constitution	0.26366716623306274
Boston Scientific said it has gained 51 percent of the coated-stent market in Europe.	It estimated on Thursday it has a 51 percent market share in Europe	0.8114534616470337
A train traveling down the tracks.	A train on the train tracks	0.7052979469299316
I said she has not ever had to be a part of any workforce.	It doesnt say that it didnt participate	0.4312421977519989
Costa's semifinal opponent is Spaniard Juan Carlos Ferrero, whom he beat in last year's final.	Nadal tumbles into French Open final	0.48119473457336426
The network will drop one edition of "Dateline," its newsmagazine franchise.	The findings are published in the November 6 edition of the journal Nature	0.4488047659397125
The man slced through a thick rope with a sword.	A man walks across a tight rope	0.7340832948684692
NKorea makes "significant" nuclear reactor progress - IAEA	Japan closes last nuclear reactor	0.7686171531677246
Instead, prosecutors dismissed charges and Rucker left the courtroom a free man.	Instead he left the courtroom a free man after authorities dismissed criminal charges	0.7520636320114136
The tech-laced Nasdaq Composite .IXIC rallied 30.46 points, or 2.04 percent, to 1,520.15.	The Nasdaq Composite Index IXIC jumped 4364 points or 289 percent to 155373	0.29086270928382874
A large amount of penguins are heading to the ocean.	A couple are running towards the ocean	0.18648575246334076
Sony said the PSP would also feature a 4.5-inch LCD screen, Memory Stick expansion slots.	The company is also adding Net and J2EE support to its Enterprise Application Environment development toolset Sapp said	0.4758540689945221
Nigeria plane crash: No survivors	Dozens killed in Russian plane crash	0.4520931541919708
the meetings lasted 2 days.	the meetings lasted 2 days 	0.9114373326301575
abuja is the capital of	abuja is the capital of 	1.0
Tell me exactly which system isn't working right now?	So which system isnt working for us	0.6275022625923157
Martin said, "Why are you following me?"	The vulnerability affects Windows NT 4.0, NT 4.0 Terminal Services Edition, XP and 2000, as well as Windows Server 2003.	0.07440461218357086
China yuan weakens to 6.1818 against USD Tuesday	Chinas yuan weakens to 62767 against USD Thursday	1.0
Ukraine: Three Killed In Parliament Protests	Afghan District Governor Defects To Taliban	0
180 killed in Iran earthquake	TROPICAL CYCLONE FORMATION IS NOT EXPECTED.	0
A train traveling down the tracks.	Black train on train tracks	0.6910009980201721
Free Syrian Army captures Syrian officers	7 police officers were killed and 4 officers were wounded 	0.6024547219276428
Dignitaries pay tribute to Paul Desmarais	Stars pay tribute to Cory Monteith	0.9999998807907104
Egyptian court considers Mubarak’s release	Egypt court orders Mubarak release	0.6559181809425354
The hearing occurred a day after the Pentagon for the first time singled out an officer, Dallager, for not addressing the scandal.	The hearing came one day after the Pentagon for the first time singled out an officer  Dallager  for failing to address the scandal	0.7850721478462219
Close up of a white sheep with a black head.	A closeup of a sheep with a black head	0.755852460861206
The whole earth combined produces enough food for  billion people.	Other countries are owed at least US80 billion 10852 billion	0.5483812093734741
Romney chooses Ryan as GOP running mate	Romney announces Paul Ryan as running mate	0.5827303528785706
Spain approves new restrictive abortion law	Spanish government approves tight restrictions on abortion	0.6894332766532898
This led last month to the recovery of the 600-pound Cancun altar, Vanderbilt University in Nashville and the National Geographic Society announced Wednesday.	A little boy is playing a guitar.	0.03220442309975624
Hugo Chavez: Venezuelan officials for unity	Abbas to lead Palestinian unity government	0.5718590021133423
As far as legality goes I can use jury nullification.	The jury is not told about juror nullification	0.455670565366745
Iran Nuclear Talks Enter Third Day	A brown and white dog swims in a backyard swimming pool.	0
wait until they become more consistent and closer together.	He and the other lawyers planned to stay until the river starts receding	0.35852664709091187
BBC director general resigns over 'shoddy journalism'	US Attorney general Eric Holder to resign	0.6218929290771484
A boy plays a handheld game.	A little boy plays with a toy phone	0.6944608688354492
5 killed in S China road cave-in	10 dead five injured in SW China road accident	0.6079255938529968
Iran nuclear experts, world powers to resume talks next week	Iran world powers begin new round of nuclear talks	0.7493422627449036
Mr. Grassley and Mr. Baucus rejected any disparity in drug benefits.	Results of the 2001 Aboriginal Peoples Survey released yesterday by Statistics Canada suggest living standards have improved but still lag for those off reserves.	0.13215400278568268
A new worm has been spreading rapidly across the Internet, sometimes pretending to be an e-mail from Microsoft Chairman Bill Gates, antivirus vendors said Monday.	The Federal Trade Commission asked Congress yesterday for broader powers to attack the rapidly growing problem of spam which new studies show accounts for half of all email traffic	0.4507874846458435
Iran presidential candidate says western sanctions should be broken	Iran Moderate candidate wins presidential vote	0.44970276951789856
The back of the stop sign is adorned with stickers.	the back of a stop sign with many stickers on it	0.7204501628875732
"We're being hyper-vigilant," said Dr. James Young, Ontario's commissioner of public safety.	People are obviously inconvenienced said Dr Jim Young Ontarios commissioner of public safety	0.7098005414009094
The woman is shooting a rifle.	A woman is firing a rifle	0.7509164810180664
The man is jumping into the water.	A man wades in the water and watches a water fall	0.4745674431324005
a computer on the floor.	An Apple computer sitting on the floor	0.6422779560089111
Three men sitting at the table with beer and food.	A group of people sitting around a table with food on it	0.5933302044868469
Several people are sitting around a fire at night.	Four people are sitting around a living room withsnacks	0.5668501257896423
A red truck spins their tires while a black one leaves the frame.	A bicyclist in black on a black and red racing bike	0.5300958156585693
But Itar-Tass news agency said four of his bodyguards were among those killed by the bomb.	Car bomb kills four in Hezbollah Beirut bastion minister	0.35185280442237854
Founded in 1996, the LendingTree exchange consists of more than 200 banks, lenders, and brokers.	LendingTree matches borrowers via the Internet with more than 200 mortgage brokers banks and other lenders	0.3936423361301422
A woman is riding a seadoo.	The woman is riding a horse	0.7905356287956238
To force a recall election of Davis, the valid signatures of 897,158 registered California voters must be turned in to election officials.	The valid signatures of 897158 registered California voters must be collected and turned in to county election officials by Sept 2	0.8153902888298035
Two kids push an inflatable crocodile around in a pool.	Four kids holding hands jump into a swimming pool	0.34092915058135986
Four people are floating on a raft.	A woman is resting in a floating raft	0.5089088678359985
A young woman in a pink hoodie takes a picture.	A girl in a red shirt takes a picture on a phone	0.4626794457435608
the conventional forces in europe treaty limits the number of military aircraft, tanks and other non-nuclear heavy weapons in europe. 	Kerry: $4b Palestinian Economic Plan Could Work	0
The Face Of The Franchise: The worst part is that he's not even a Leafs fan!	A cat swings on a ceiling fan	0.026613757014274597
A lamb stands near two tiny animals.	A man holds a small animal in one hand	0.3454608917236328
The blue-chip Dow Jones industrial average eased 44 points, or 0.47 percent, to 9,543, after scoring five consecutive up sessions.	The Dow Jones industrial average DJI edged up 1333 points or 015 percent to 919655	0.5012561082839966
A woman is picking tomatoes.	A woman is cutting a tomato	0.4528140127658844
Woman dies after cliff collapses in Dorset	Three die after car crash at Tiananmen	0.549858033657074
St. Paul Chairman and Chief Executive Jay S. Fishman, 51, will be CEO of the combined company.	Jay Fishman 51 chairman and chief executive of St Paul will be chief executive of the combined company	0.3030444085597992
A person is quickly chopping mushrooms with a knife.	A person is cutting mushrooms with a knife	0.7522298097610474
GL, Terral That is absolutely amazing.	Hi Ollie That is absolutely amazing	0.7262189388275146
Pakistan imposes temporary ban on 2 TV channels	A radio station has suspended two disc jockeys for locking themselves in the studio and continuously playing Dixie Chicks songs violating the stations twomonthold ban on the groups music	0.47392186522483826
Kids play soccer on a field.	A lone cow sits in the cold of the yard.	0.09782397747039795
EU finance ministers‚Äô talks b...	Sandusky found guilty in child sex abuse trial	0.0011702434858307242
A close up of an ostrich face.	A closeup of an animal with a long face standing on grass near a tree	0.3256746530532837
A man is making a phone call.	A man is speaking on a phone	0.7603557705879211
Two dogs share a toy in a field of vegetation.	Three dogs play in a grassy field	0.6013330221176147
A black dog playfully bits another dog in a living room setting	A black dog and a brownandwhite dog play in a field	0.6690831184387207
Parents received letters informing them of the possible contamination yesterday.	The Note's Must-Reads for Tuesday October 29, 2013	0.038126975297927856
Egypt's Coptic Church Prepares to Choose Pope	Algerian national turnout of parliamentary vote reaches 44.38 pct	0.044448159635066986
UN Adopts Syrian Chemical Weapons Resolution	Bush wanted "to see an aircraft landing the same way that the pilots saw an aircraft landing," White House press secretary Ari Fleischer said yesterday.	0
A girl is making eyelid.	The girl is using an eye pencil on her eyelid	0.4082273244857788
N.C. State Fair ride operator arrested after accident	Zambias exPresident Rupiah Banda arrested	0.5302177667617798
A woman is pouring ingredients in a bowl.	A person is mixing ingredients in a bowl	0.5926286578178406
The technology-packed Nasdaq Composite Index <.IXIC> dropped 37.78 points, or 1.94 percent, to 1,912.36.	Taliban soldiers posing as pretty women on Facebook to get troops' secrets	0.003659053472802043
Originally Posted by SolInvictus Ah.	Originally Posted by eleanorellis	0.9999999403953552
Hezbollah targets Qaeda gathering along border with Syria	Tropical Storm Karen targets US Gulf Coast	0.6085821390151978
British Soldier Killed In Afghanistan	Afghan District Governor Defects To Taliban	0
Man in red jacket standing in front of lighthouse.	The child in the red coat laid in the red mat	0.6321345567703247
Israel Approves New Settlement Homes Ahead of Peace Talks	AlQaida Leader Urges Kidnapping of Westerners	0.9999998807907104
A dog is playing in the snow.	Two dogs playing in the snow	0.6197081208229065
Little white lamb with nose to wood.	A white lamb with its nose against a wooden box	0.7712996602058411
Syrian forces kill 54 ahead of Annan peace mission	Indian troops kill Pakistani soldier along Kashmir line of control	0.44585204124450684
Two bays are dancing.	Two men are dancing	0.1216847151517868
US says Syria may have used sarin gas in chemical weapons	War crime UN finds sarin used in Syria chemical weapons attack	0.7330593466758728
Tropical Storm Isaac boosts jobless claims	Spain jobless rate hits new high	0.4521189033985138
A man is putting broccoli into water.	A woman is cutting broccoli	0.7082406878471375
A deer jumps a fence.	A deer jumping over a fence	0.7325581312179565
Three children are eating their food.	A man is eating his food	0.5137242674827576
But Merrill Lynch analyst Steven Milunovich said the "somewhat ambiguous ruling" by regulators might be a setback for Static Control depending on how it developed its competing product.	They are actually going to record sales for Velcade this year said Matt Geller an analyst at CIBC World Markets	0.3916780948638916
A deer jumps over a cyclone fence.	A deer jumping over a fence	0.641446590423584
A yellow bird perched on a branch.	Two Eagles perched on a branch	0.3445884883403778
A woman is shredding chicken.	A woman is cutting up a chicken	0.5856431722640991
Missouri health officials said he had not been hospitalized and is recovering.	UKs Prince Philip hospitalized	0.6380090713500977
a black and white cow in hay.	A black and white cow in a pen with hay	0.7311345934867859
An elderly woman walking uphill crossing the street.	An elderly woman rides a bicycle along a city street	0.5411882400512695
The audiotape aired last week by the Arab Al-Jazeera television network appears to be an effort to incite attacks.	A television with a show on	0.47630470991134644
The tech-laced Nasdaq Composite .IXIC rallied 30.46 points, or 2.04 percent, to 1,520.15.	The Nasdaq Composite Index IXIC was off 652 points or 039 percent at 164566	0.24049147963523865
49 feared dead in Buenos Aires train crash	Five dead in Canada train crash	0.7034726142883301
A person is doing pencil tricks with his hand.	A man is doing tricks with a soccer ball	0.5311463475227356
A dog bounds across the brown grass.	Carney sets high bar to change at BoE	0.07772348076105118
The weather service reported maximum sustained winds of nearly 105 miles an hour with stronger gusts.	The heatwave was due to a mass of hot dry air from the southeast said Mario Almeida of Portugals weather service	0.419104665517807
If you answer yes to  and no to  you are probably straight.	Cyracuz What you want to call it is up to you	0.437831312417984
A little girl holds a wooden stick.	After protesters rushed the stage and twice cut power to the microphone, Hedges drew the speech to an early close.	0.015204315073788166
Obama travels to tornado-ravaged Oklahoma	Two trains are traveling on the track	0.33207613229751587
A person dressed in white on a brown horse.	Person dressed in blue riding brown horse	0.5295498967170715
Thus, ultimate sovereignty.	but okay ultimate sovereignty	0.5305805802345276
A man is holding a leaf.	A young man is talking to a leaf	0.32050687074661255
Secret Service sees its 'biggest scandal' over prostitutes	Lance Armstrong plots strategy after loss of titles	0.02749873325228691
N. Korea fires short-range missiles	North Korea launches shortrange missiles	0.7038185000419617
A machine is sharpening a pencil.	A man sharpens a pencil using a knife	0.2832448482513428
Sony reports record annual loss	Stansted Ryanair reports 13 rise in annual profits but warns of slower growth this year	0.5143812894821167
The boy is stuck in the door of the doghouse.	A boy is crawling into a dog house	0.3772936463356018
A black and white horned cow standing in a field.	Syria military police chief defects to opposition	0.0685645043849945
The Rev. John Johnston, 64, was charged with aggravated harassment in the phone call case and with criminal possession of a weapon, according to a police statement.	Four of the defendants have pleaded guilty to weapons charges and other counts	0.44292619824409485
A dog is opening a fridge.	A dog opens a can of food	0.7046462893486023
Two girls are jumping high in the air.	Two girls jump out of swings	0.6860561370849609
Maldives president quits after weeks of protest	Mexico swears in president amid violent protests	0.4886816442012787
China manufacturing expands in September	China manufacturing index at 11month low HSBC	0.39360326528549194
A young boy wearing only green shorts poses awkwardly with a brick background.	A young boy laying on a sofa with a dog	0.4841003715991974
Gunmen kill 10 in Philippine political violence	Fire in Beijing kills 10	0.54161137342453
zhang yan stated that all countries should abide by non-proliferation obligations in order to enhance mutual trust and create a sound environment for international cooperation in nuclear energy.	adherence to nonproliferation obligations will enhance mutual trust and foster international cooperation in nuclear energy 	0.6962176561355591
A woman is riding a blue bicycle in a park.	A girl is riding a bicycle	0.7148738503456116
The Note's Must-Reads for August 1, 2012	EU Receives 2012 Nobel Peace Prize	0.9438971877098083
president putin stated that russia would take countermeasures. 	russian president putin signs decree suspending russias application of european arms control treaty 	0.6275040507316589
The technology-laced Nasdaq Composite Index <.IXIC> added 1.92 points, or 0.12 percent, at 1,647.94.	The technologylaced Nasdaq Composite Index IXIC added 827 points or 051 percent to 163353	0.48788657784461975
Islamist parties in Egypt unite for elections	Pakistans opposition party boycotts presidential elections	0.520304799079895
Death toll in Nairobi attack rises to 59	It seemed like an isolated incident," said Ariel Dean of Washington D.C., who earned a degree in political science.	0.00813016016036272
Man sleeping on the street.	A man is running on a street	0.15718545019626617
Officer injured in India anti-rape protests dies	Indian policeman injured in gangrape protest dies	0.7774083614349365
You're such a bad person!"	Oh youre such a good person	0.3734378218650818
Winter Storm Janus: State-by-State...	Afghan District Governor Defects To Taliban	0
A siamese cat resting on a white sofa.	Yellow striped cat resting on blue sofa	0.4803973436355591
Originally Posted by Vienna To 'say' what?	Should I just tell her how I feel	0.01635652221739292
But U.S. troops will not shrink from mounting raids and attacking their foes when their locations can be pinpointed.	Protests and appeals for calm after Zimmerman acquitted of Trayvon Martin murder	0.11735572665929794
A girl wearing black shorts and boots is standing next to a blue motorcycle.	A girl in a black and blue wet suit is surfing	0.599896252155304
abuja is the capital of 	tirana is the capital of 	0.8397258520126343
We in Britain think differently to Americans.	Syrian Opposition Council to Establish Envoy in France	0.4862743318080902
Conmen dressed as women steal cash	CCTV York conmen dress as women to trick pensioners	0.4907415509223938
A woman is applying cosmetics to her face.	A woman is applying eyeshadow	0.6013675332069397
The man cut some carpet with a knife.	A man is cutting carpet with a knife	0.715948760509491
You need to reread what I wrote.	Garner said the self-proclaimed mayor of Baghdad, Mohammed Mohsen al-Zubaidi, was released after two days in coalition custody.	0.052749842405319214
A woman in a black apron is standing in front of a mirror.	Five things to watch in the presidential debate	0.08726178854703903
Fidel Castro celebrates 86th birthday	Castro celebrates 86th birthday Monday	1.0
A young boy is holding a guitar.	A little boy is playing a guitar	0.4158221185207367
A girl in orange lights a candle.	India's first post office savings bank ATM inaugurated in Chennai	0.10713557153940201
Water samples are being sent to the state health department for analysis.	Missouri health officials said he had not been hospitalized and is recovering	0.4100024104118347
lets assume we have % white and % black.	Imagine a place thats  white and  black	0.34636473655700684
Syria 'to declare chemical weapons and sign convention'	End near for Syrias chemical weapons	0.6453624963760376
Radio prankster in tears over nurse’s death	No extortion, no bribery, no money involved Only class E felonies.	0.045744750648736954
the cfe is very important for european security. 	Some believe the right is most important	0.3833388090133667
A woman is cutting broccoli.	A woman is chopping broccoli	0.602756679058075
Ten rockets from Gaza land in southern Israel; none hurt	2 rockets hit Eshkol none injured	0.6019840836524963
The military said it had killed 16 rebels and captured nine in the campaign so far, with one soldier killed and six wounded.	The military said it had killed 12 rebels and captured nine in the campaign so far for the loss of six soldiers wounded	0.7876445651054382
Japan marks one year since quake and tsunami disaster	No damage tsunami after 66 quake hits off Indonesias Sumatra	0.6617855429649353
A brown and white dog runs across the grass.	A brown and white dog is running across the grass	0.8665726780891418
Stocks rise early after Greek deal, then flatten	Stocks edge higher after Greek debt deal	0.3993639051914215
I don't have a proposed model.	Women models are walking down a catwalk	0.2293664962053299
Enron's 401(k) plan covered about 20,000 workers, retirees and beneficiaries.	As to would I kill  person to save , I have no idea.	0.09788736701011658
The man is playing the drums.	Man dies in Co Donegal house fire	0.07106782495975494
The proportion of people covered by employers dropped from 62.3 percent in 2001 to 61.3 percent last year.	The proportion of Americans with insurance from employers declined to 613 percent from 626 percent in 2001 and 636 percent in 2000	0.7730312943458557
India Braces for Massive Cyclone	Air Force Instructor Faces Sentencing for Rape	0.9999998807907104
You should put scientists on a pedestal.	Why do people like you put scientist on a pedestal	0.5588300228118896
Children are playing in a swimming pool while two adult men watch them.	Children play in a pool while adults look on	0.719436764717102
The epidemic began in November in the mainland's Guangdong province, but the People's Republic of China refused to report truthfully about its spread for four months.	A long awaited report on the Hong Kong governments handling of the SARS outbreak has been released	0.42686039209365845
there is conflicting opinion as to the extent of damage suffered by the insurgency. 	violence continues despite conflicting opinion on the extent of damage suffered by the rebel groups	0.7155347466468811
Isaac drenches Haiti, heads toward Cuba, Florida	Tropical Storm Isaac drenches Haiti swipes Cuba	0.4709080755710602
Lots of people play in the water at the beach.	The dog ran in the water at the beach	0.4910827875137329
Suspected drone strike kills 4 in Pakistan	US drone kills 4 militants in Pakistan	0.8213854432106018
TNK-BP has six oil producing units, five refineries and 2,100 filling stations.	The venture owns five oil refineries and more than 2100 filling stations in Russia and Ukraine	0.6789608597755432
At least six dead in US shooting rampage	At least 6 dead in Paris train crash	0.6159659624099731
World powers seek rare progress in Iran nuclear talks	Muslim Brotherhood supporters die in Egypt clashes	0.06999622285366058
@edgarblythe, So Lyndon Johnson and John Kennedy were compatible?	Lustig Andrei So Lyndon Johnson and John Kennedy were compatible	0.4991409480571747
Obama condemns Egypt violence, cancels military exercises	AL renews condemnation on Syrias violence	0.31830161809921265
Kerry's plan for restarting talks calls for release of 103 Palestinian inmates	Israels Peres calls for return to peace talks	0.4895358979701996
A cat is crawling under a piece of furniture on it's back.	A cat is crawling upside down under the couch	0.5686212778091431
Bremer said one initiative is to launch a $70 million nationwide program in the next two weeks to clean up neighborhoods and build community projects.	Bremer said he would launch a 70million program in the next two weeks to clean up neighborhoods across Iraq and build community projects but gave no details	0.7467198371887207
Thai opposition party to boycott general election	Pakistans opposition party boycotts presidential elections	0.7184646129608154
Man sitting by himself on a pier with a bottle of water.	Two people sit on a dock near the water	0.5336499810218811
The victim, who was not identified, was taken to Kings County Hospital where he was pronounced dead.	The shooting victim was taken to Kings County Hospital Center where he later died the police said	0.5162719488143921
Thousands rally to support embattled Tunisia government	Abbas to lead Palestinian unity government	0.5093000531196594
"I notice a mood change in their priorities," said one Iraqi politician after meeting with Mr. Bremer.	Schroeder cancelled his Italian holiday after Stefani refused to apologise for the slurs which came after Berlusconi compared a German politician to a Nazi concentration camp guard	0.43797868490219116
The man ran and jumped against the wall.	A man is jumping a wall	0.324571430683136
No charges have been filed in those deaths, but Luzerne County District Attorney David Lupas said authorities were "continuing to make significant progress" in the case.	Luzerne County District Attorney David Lupas told a news conference Monday that authorities were continuing to make significant progress in the case	0.460049569606781
Malaysia's ruling coalition wins majority	Defense lawyers had said a change of venue was needed because massive pretrial publicity had tainted the jury pool against their client.	0.03657028451561928
China’s new carrier extends military modernization drive	What's my opinion regarding the series?	0.016897588968276978
