sentence_1	sentence_2	score
10 kurds are under investigation in france on suspicion of money-laundering for a terrorist organization known as kurdistan workers' party (pkk).	Jury nullification does not mean that a law is unconstuitutional.	0.010180148296058178
Kerry pursuing 'quiet strategy' in Mideast peace process	US Afghan govt to hold peace talks with Taliban	0.5137937068939209
Anyway, welcome back.	Lacey  welcome back	0.8769587874412537
Suicide bomber kills 14 in Afghanistan	Suicide bomber kills at least 4 in Kabul	0.775323212146759
Poland honors president killed in 2010 plane crash	Ten killed in Alaska plane crash	0.6789427399635315
She asked to be excused from last week's Cabinet session to prepare for a meeting with the presidents of Rwanda and Uganda.	She took the highly unusual step of skipping cabinet to attend a meeting with the presidents of Rwanda and Uganda	0.6677724123001099
Brother of EastEnders actress Gemma McCluskie is charged with her murder	Conte said Druce will be charged with murder	0.5910082459449768
Customers that pay the $1,219 entrance fee get SMS 2003 with 10 device client access licenses.	Retail pricing for SMS 2003 with 10 device client access licenses is 1219	0.7163090705871582
Gunmen Kill 11 Foreign Tourists in Pakistan	Two Earthquakes Hit Northwest China 11 Dead	0.9381323456764221
Board Chancellor Robert Bennett declined to comment on personnel matters Tuesday, as did Mills.	The FBI CIA Canadian Security Intelligence Service and Royal Canadian Mounted Police declined to comment on the Washington Times report	0.6551386117935181
The unemployment rate is predicted to have ticked up a percentage point to 6.1%.	Based on a separate survey of households the unemployment rate fell in August to 61 percent from 62 percent	0.5187408328056335
Facilitator : And why is she the dumb child?	Also weighing on the market was news that General Motors GM.N planned to issue $10 billion in debt, in part to plug a hole in its pension plan.	0.007128265220671892
Russia, China in double veto of UN Syria resolution	UN to take up Syria resolution	0.47280916571617126
Quiz crossword - Saturday 27th April	Indian troops raid Pakistani military post	0.05914446339011192
Shares of USA Interactive rose $2.28, or 7 percent, to $34.96 on Friday in Nasdaq Stock Market composite trading and have gained 53 percent this year.	Shares of Littleton Coloradobased EchoStar rose 163 or 53 percent to 3226 at 1055 am	0.5676156878471375
Syria's tenuous truce takes hold	Israel and Hamas to observe brief Gaza truce	0.6046441793441772
Water samples are being sent to the state health department for analysis.	The department also sent water and soil samples to the state health laboratory	0.7449123859405518
A man is tying on a stenographers machine.	A man is tying a noose	0.6288625001907349
india accuses pakistan of funding and training the cross-border guerrillas.	D.C. Votes to Decriminalize Marijuana	0.03615240007638931
Germany ready to help Syria chemical mission	Libya ‘destroys last chemical weapons’	0.5308144092559814
Turkey Raises Alarm Over Syrian Refugees	Minn Terminal Reopens After Bag Causes Evacuation	0
Breivik gets 21-year sentence	Protests at Pussy Riot verdict	0.5391933917999268
The Ministry of Defence is facing a 20m compensation claim from hundreds of Kenyan women who claim they were raped by British soldiers.	Hundreds of Kenyan women claiming they were attacked and raped by British soldiers were granted government legal aid Wednesday to pursue their case against the Ministry of Defense	0.5416646003723145
A man riding a unicycle down a paved road	A person is driving a motorcycle on a road	0.6675585508346558
Pakistani girls learn a hard lesson	What if they messed up a study	0.3776036202907562
a black and white photo of a cat lying down.	Mandela spends third day in hospital	0.04371371865272522
A cat is watching a TV.	A cat stares into the camera	0.7036386132240295
Islamic State posts second propaganda video of UK hostage	A woman is slipping in the water-tub.	0.11928652971982956
Man in red shorts and white shirt kicking a soccer ball.	Implications of Palestinian reconciliation	0.07883285731077194
Standard & Poor's 500 stock index futures declined 4.40 points to 983.50, while Nasdaq futures fell 6.5 points to 1,206.50.	China stock index futures close lower  April 23	0.5132008790969849
Motor Racing: Button fastest in year's first F1 practice	Button boasts best time after first practice	0.591569185256958
Man, 40, arrested after shooting	US Capitol Hill on lockdown after shots fired	0.7398539185523987
GL, Terral That is absolutely amazing.	Morals have absolutely nothing to do with it 	0.42982596158981323
wen states that the main purpose of the germany visit is to advance trade, economic and technological exchanges. 	Asian markets gain on upbeat US economic data	0.3013184070587158
A man is loading a rifle with bullets.	Who makes money off google ad sense?	0.0521056205034256
Other changes in the plan refine his original vision, Libeskind said.	20-member parliamentary, trade team leaves for India	0.15073652565479279
A woman is speaking in sign language.	A girl is communicating with sign language	0.6195443868637085
A woman is cracking three eggs into a bowl.	Two trains are traveling on the track.	0.009136631153523922
the international atomic energy agency may have been tricked because it was eager for a deal. 	the international atomic energy agency is based in	0.7123360633850098
The man added vegetables to the broth in the pot.	A man is adding sliced vegetables to a cooking bowl with water	0.7021573185920715
russia ratified the updated treaty in 2004 but the united states and other nato members have refused to do so arguing that moscow must first fulfill obligations to withdraw forces from georgia and from moldova's separatist region of trans-dniester. 	russia has ratified the amended version but the united states and other nato members have refused to do so until the russian government withdraws troops from the former soviet republics of moldova and georgia 	0.7039082646369934
A classroom of students watching a presentation.	Govt to hold talks with FTII students	0.5846413969993591
The Dow Jones rose 41.61 points Friday, a gain of 0.4% for the day and 0.7% for the week.	The SPTSX composite rose 8774 points on the week while the TSX Venture Exchange composite gained 4449 points	0.46822574734687805
French presidential election: first round - live updates	Maldives holds fresh presidential election	0.4699045717716217
Pakistan executions draw international ire	the amnesty international report was compiled by european and international nongovernmental forums	0.5733524560928345
Insight: U.N. chief finds his voice, but remains cautious on China	A passerby found the boy hiding along a dirt road in Spanish Fork Canyon about 7 pm Thursday with his feet free but his hands still taped	0.3885713517665863
Norway marks anniversary of massacre	Violent clashes mark anniversary of Egypt uprising	0.6293124556541443
March  is also the date for the uprising in CHINA.	Violent clashes mark anniversary of Egypt uprising	0.4635383188724518
7.7-magnitude earthquake hits SW Pakistan	Strong earthquake hits Mexico	1.0
The matter could then be sent to the U.N. Security Council.	Remains in Winchester could be King Alfred the Great	0.45157957077026367
A man is swinging from a rope attached to the ceiling.	A man is swinging in a rope	0.8464001417160034
EU extends sanctions against Russia	G7 to intensify Russia sanctions	0.7490406632423401
Libyan government retakes Tripoli airport	Explosion near Damascus military airport	0.48995429277420044
A woman is feeding an aardvark.	A woman is making some food	0.7367011904716492
Two cats are looking at a window.	Gray cat looking out the window	0.557116687297821
Three sheep on a dirt road viewed from a passenger vehicle.	Three sheep in middle of gravel road	0.5112082958221436
Putin claims victory in presidential vote	Poll Putin to win Russia presidential vote	0.8064715266227722
Conmen dressed as women steal cash	A man and two women dressed in costumes	0.5262333154678345
MSNBC.com first reported the CIA request on Friday.	CocaCola Co KO reported higher profit for the quarter helped by European demand early on Thursday	0.5131022930145264
Avengers sets box office record	The Hunger Games breaks US box office record	0.8522910475730896
The lady cut up a green onion.	The lady chopped up the green onions	0.7612770795822144
A dog is running through a backyard full of leaves.	The tan dog runs through the leaves	0.4741320013999939
Voracek with the goal.	Hezbollah targets Qaeda gathering along border with Syria	0.22701431810855865
A woman stands in front of a building in the snow.	A woman posing in front of an apartment building in the snow	0.6686458587646484
U.S. drone kills 4 militants in Pakistan	Why are Russians in Damascus?	0.14759990572929382
Israel Carrying Out Ground Offensive In Gaza	Minn Terminal Reopens After Bag Causes Evacuation	0
String of Iraq blasts kills at least 32	Plane crash in Ghana kills at least 10	0.5419120192527771
The little boy is singing and playing the guitar.	A man is playing the guitar and singing	0.6257385015487671
USDA Confirms Case of Mad Cow Disease in California	Government of Canada Supports Womens Safety in Regina	1
The woman is smoking.	A woman is smoking	0.6417759656906128
Obama to announce gun control plans Wednesday	Obama to set out gun control plans	0.8206013441085815
N.C. State Fair ride operator arrested after accident	Ride operator charged in NC fair accident	0.5898599624633789
A man plays a keyboard.	A man is playing a keyboard	0.6455078125
Piers Morgan questioned by police	Iraqi police opened fire in downtown Baghdad Wednesday after demonstrators demanding jobs stormed a police station and threw stones at officers police said	0.5672314167022705
Landon And So This is Christmas We are all vessels filled with many wonders.	Holly Holy We are all vessels filled with many wonders	0.8834444284439087
The union said it would reveal later which chain would be targeted.	The union had not yet revealed which chain would be targeted	0.7240391969680786
38 feared dead in Russian psychiatric hospital fire	At least 1 dead 40 hospitalized in Southwest heat wave	0.4443015158176422
Islam has always been political.	Top Chinese political advisor meets Greek PM	0.04446661099791527
The center's president, Joseph Torsella, was struck on the head but was able to walk to an ambulance.	Indonesian president to visit Australia	0.23083697259426117
The House voted 425 to 2 to clear the bill, the first of 13 that Congress must pass each year to fund the federal government.	House set to vote on plan to reopen government	0.36922064423561096
A man is cutting tomatoes.	A car backs out of a space.	0.08646460622549057
A dog emerges form the water with a stick in its mouth.	A dog swimming with a stick in its mouth	0.5569519996643066
the defendants smuggled more than 11 kilograms (24 pounds) of heroin.	naeem m smuggled 10 kilograms 22 pounds of heroin 	0.5435442328453064
Putin signs Crimea annexe treaty	A living room with table, chair and sofa alongside a large palm.	0.03464403748512268
A little girl is playing a grand piano on stage.	A little girl is playing the piano	0.8750072717666626
Lebanon's PM forms 'unity cabinet' Lebanon's prime minister has formed a cabinet more than 10 months after taking office, taking in a wide range of political groups after bridging serious divisions am	BEIRUT Lebanons prime minister formed a cabinet more than 10 months after taking office yesterday including a wide range of political groups after bridging serious divisions among them mostly over	0.8726717233657837
Uganda's President Museveni agrees to sign anti-gays Bill	Obama signs up for Obamacare	0.48783931136131287
Pregnant Sudan woman who married a Christian man sentenced to death for 'apostasy'	Chicago man to be sentenced for terror convictions	0.48127132654190063
It was announced that Green will replace Park in the Dale Earnhardt Inc. No. 1 Chevrolet, beginning with the Winston Open at Lowe's Motor Speedway next week.	bae systems is the uk's largest military	0.001869547413662076
The three children are standing on and by a fence.	Spain princess testifies in historic fraud probe	0.09094945341348648
Women drivers to face insurance premium rise	Women to face higher car insurance premiums	0.7694503664970398
At least 6 dead in Canada bus, train crash	Five dead in Canada train crash	0.782169759273529
More than 100 police officers were involved in the busts that were the culmination of a two-year operation investigating the cocaine importing and money laundering gang.	the dans stated the gang engaged in illegal activities including racketeering blackmail arms smuggling cigarette smuggling and money laundering	0.4495765268802643
A man is eating a bowl of cereal.	Dynes came to UC San Diego in 1991 after 22 years as a physicist with AT&T Bell Labs.	0.03693990781903267
Russia unveils $25bn oil link to Pacific	Explosion hits oil pipeline in Syrias Homs	0.5671038031578064
Iraq's economy was shattered under former president Saddam Hussein and by the U.S.-led war to oust him which ended in April.	Iraqs economy was ravaged during years of UN sanctions over expresident Saddam Husseins 1990 occupation of Kuwait and by the USled war to oust him which ended in April	0.5792446732521057
Islamist Morsi Wins Egypt's Presidential Election	California governor declares drought emergency as wildfires continue to burn	0
American Chris Horner wins Tour of Spain	Ill Have Another wins Preakness	0.959753692150116
Ankeet Chavan granted conditional bail for marriage	Ankeet Chavan granted bail to get married	0.7471947073936462
A man is meditating.	A man is praying	0.5324587225914001
Standard & Poor's 500 stock index futures declined 4.40 points to 983.50, while Nasdaq futures fell 6.5 points to 1,206.50.	Standard  Poors 500 stock index futures for June were down 260 points at 96570 while Nasdaq futures were down 750 points at 118350	0.7882952094078064
Thousands of troops to march for Jubilee	Andy Murray deserves knighthood, David Cameron says	0.0288961473852396
Al-Qaida Leader Urges Kidnapping of Westerners	Bangladesh Crackdown Escalates Ahead of Election	0.9999998807907104
The prices of everything you own IE assets have gone down.	Egypt freezes Muslim Brotherhood assets	0.4131079316139221
70 retailers agree to new Bangladesh factory safety pact	Retailers back Bangladesh factory safety pact	0.6231095194816589
In an interview, Ms. Healey, who is a criminologist, said many lawmakers here and across the country shared a wariness toward capital punishment.	We condemn and denounce the Governing Council which is headed by the United States Moqtada alSadr said	0.35157760977745056
Jordan Green, the prelate's private lawyer, said he had no comment.	The rappers lawyer Mark Gann didnt return calls for comment	0.16147491335868835
Nigeria plane crash: No survivors	Missing Malaysia Airlines plane crashes off Vietnam	0.5190050601959229
A dog jumping into a swimming pool.	A dog is swimming in a pool	0.7294820547103882
Rusch has also allowed five or more earned runs in each of his last three starts.	The one that has three walks home and beats his wife	0.388092964887619
Kathy Nicolo (Jennifer Connelly) is desperate that her family not find out that her life has fallen apart.	If it wasnt a life then it would not be able to be born	0.3707132935523987
Minn. terminal reopens after evacuation	A person is playing a guitar.	0.024960260838270187
Black and white cat lying under bush.	A black and white cat lying on a blanket	0.7610645890235901
Scribner's body was found floating in the city's Portage Bay, where he lived with his wife in a houseboat.	Leon Williams body was found inside his thirdfloor apartment at 196 Bay St in Tompkinsville	0.5488976836204529
Four dogs splashing in the water	A dog splashing in the water	0.8798069953918457
A small white dog and large brown dog play on the grass.	a brown and white dog is running on the grass	0.7016732692718506
The broader Standard & Poor's 500 Index .SPX fell 3 points, or 0.30 percent, to 995.	The broader Standard  Poors 500 Index SPX gained 3 points or 039 percent at 924	0.5996071696281433
A home office with three computer monitors and other equipment on a desk.	By law, 911 calls are not public information in Rhode Island.	0.10102365911006927
a computer on the floor.	A Macintosh computer sitting on the floor	0.6422779560089111
The man in the red shirt is climbing the side of a mountain.	A girl in a red shirt takes a picture on a phone	0.5879682898521423
A man and woman are posing for the camera.	A man and a woman looking at the camera	0.5402841567993164
Talabani told him the Governing Council would "need UN assistance and advice in implementing the new decisions which have been taken."	Talabani told him Iraqi leaders would need UN assistance and advice in implementing the new decisions which have been taken on organising an interim Iraqi government by June	0.7569901347160339
Austrian found hoarding 56 stolen skulls in home museum	Austrian man charged after 56 human skulls are found at his home	0.6221047639846802
Between 1993 and 2002, 142 allegations of sexual assault were reported.	From 1993 to 2002 there were 142 reported sexual assaults at the academy	0.7014082670211792
France Hails Breakthrough after U.S.-Russia Deal on Syria Weapons	A person is slicing a carrot into pieces.	0.03730170056223869
I'm "a bunch of cells."	Ernst & Young admitted no wrongdoing with the settlement.	0.09383080899715424
Salvador Dali painting snatched in NYC	A man is drawing a picture	0.6196960210800171
An air plane is taking off.	Gunman Among 7 Dead After Florida Apartment Shooting	0.016114607453346252
Man convicted in Vatican leaks case	Bradley ManningWikiLeaks case turns to sentencing	0.5138552784919739
The computers were reportedly located in the U.S., Canada and South Korea.	A television and a laptop computer are on in a hotel room	0.48994848132133484
He attributed some of the communication gap to doctors feeling pressed for time; patients cited discomfort discussing financial issues.	He and his colleagues attributed some of the communication gap to doctors feeling pressed for time	0.6778770089149475
The dog walked along the edge of the pool.	A dog is walking along a pool	0.4912656247615814
A small monkey walks through water.	A man shows off a small monkey	0.5891229510307312
No blocks to investment	North Korea blocks Kaesong access	0.543287456035614
It's not how it was sold, gb.	Except that it wasnt	0.6201575994491577
Egyptologists cast doubt Tuesday on an expedition's claim that it may have found the mummy of Queen Nefertiti, one of the best-known ancient Egyptians.	An Apple computer sitting on the floor.	0.048622507601976395
Mr Hughes had seen Amrozi's face on television, the infamous images of the grinning mechanic from east Java.	A woman is painting the face of a man	0.36623406410217285
russia is a member of the nsg.	russia is a member of the quartet on the middle east	0.7124141454696655
but okay, ultimate sovereignty?	UN says US drones violate Pakistans sovereignty	0.04016910865902901
beijing police apprehend more than 20 people including 8 foreigners in suspicion of using and trafficking drugs in 2 pubs in a popular downtown area. 	Detroit eligible for bankruptcy protection	0.044897548854351044
The technology-laced Nasdaq Composite Index <.IXIC> added 1.92 points, or 0.12 percent, at 1,647.94.	The Nasdaq Composite Index IXIC was off 652 points or 039 percent at 164566	0.2864437997341156
Shares of Gillette closed down 45 cents at $33.70 in trading Wednesday on the New York Stock Exchange.	Sovereign shares closed on the New York Stock Exchange at 1568 down 74 cents or 45 percent	0.7152631878852844
Along with Boston, Watertown, Saugus and Framingham also are going smoke-free Monday.	the treaty was first signed in 1990. 	0.038249243050813675
U.S. has determined Syria used chemical weapons	US suspects Syria used chemical weapons	0.7938469648361206
7 Things to Know About Ethanol	7 Tibetans selfimmolate in China	0.9051439762115479
Kabul Bank Heads Sentenced for Corruption	Ships Train for Syrian Chemical Weapons Transport	0.9999998807907104
A judge ordered the child placed in state custody Aug. 8.	A federal magistrate in Fort Lauderdale ordered him held without bail	0.5122016072273254
And here I thought I knew me some math.	Funny I thought the same thing about some math	0.3835585117340088
The tech-loaded Nasdaq composite rose 20.96 points to 1595.91, ending at its highest level for 12 months.	The Dow Jones industrial average DJI added 28 points or 027 percent at 10557 hitting its highest level in 21 months	0.3881719708442688
USDA Confirms Case of Mad Cow Disease in California	Egypt IPI Urges Release of Al Jazeera Journalist Arrested in Berlin	1
The woman is seasoning the oil.	A woman is adding oil to a dish	0.4446057081222534
Unless it's different in different countries?	So short form yes it probably is different in different countries	0.6176527142524719
Pope thanks public for joining his Syria vigil	SpaceX docks with International Space Station Up next public travel	0.3924051523208618
A black and white cow looking through the fence.	a black and white cow standing in the field	0.7499520182609558
% How much money does PP take in for abortion services?	Woman dies after abortion refusal	0.46393972635269165
Key wants Waitangi marae visit to stay	Vice President of Bolivia to visit China	0.5895185470581055
JK Rowling launches her first adult novel	His first Fathers Day as a dad his first major as a champion	0.42514777183532715
US Secretary of State John Kerry‚Äôs wife rushed to hospital	South Africas Mandela taken to hospital	0.6389768719673157
Someone is pouring milk into a blender.	Two women make something in a blender	0.22629933059215546
Sir Richard was speaking after a meeting in London with Australian Tourism Minister Joe Hockey.	N Korea agrees to talks with South	0.534939169883728
Bush wanted "to see an aircraft landing the same way that the pilots saw an aircraft landing," White House press secretary Ari Fleischer said yesterday.	On Tuesday before Byrds speech Fleischer said Bush wanted to see an aircraft landing the same way that the pilots saw an aircraft landing	0.8516929745674133
A man is speaking at a podium.	A man is making a speech at the podium	0.6190787553787231
Islamist parties in Egypt unite for elections	Algerian government parties dominate elections	0.526003897190094
Russia invites Syrian opposition for talks	Syria opposition agrees to talks	0.7880781888961792
An orange tabby cat sleeping on the sofa.	In addition, the NTSB also recommended to NHTSA that state legislation be enacted to prohibit holders of learners permits and intermediate licenses from using mobile phones while driving.	0.037317123264074326
A dog is barking at a ball.	A dog is barking at a toy	0.8599799871444702
'Iron Man' jetpacks spark concerns in Hawaii	Two dogs are playing in the grass.	0.08437520265579224
A white and black dog is jumping into a pool.	A black and white dog swimming in the pool	0.7143374085426331
Old TV alignments crack at the edges	A society fraying at the edges	0.6082895398139954
Business news and markets: as it happened, June 20, 2013	Business news and markets as it happened April 17 2013	0.6253374814987183
Houston Texans head coach Gary Kubiak hospitalized after collapsing at game	Texans coach Gary Kubiak in stable condition after collapse	0.5931557416915894
A group of sheep are on a hill.	A sheep stands on a hillside	0.6043530106544495
Man riding a bicycle down a narrow path.	The man is riding a motorcycle down the road	0.5768837332725525
A black pet dog runs around in the garden of a house.	A woman pets a dog in a gated yard	0.659507691860199
William Hague: US decision to halt missile test 'sensible'	US postpones missile test over N Korea tensions	0.5292782783508301
In a mixture of ancient Melanesian pagan and modern Christian ceremonies the people tried again to erase the misfortunes they believe have kept them poor since that long-ago meal.	In a mixture of ancient pagan and modern Christian rites the villagers have staged a series of ceremonies hoping to erase the misfortunes they believe have kept them poor	0.8391954302787781
an institute for public policy research report said there are 27 weak states that pose a threat to britain's national security as the states could provide bases for terrorists. 	A girl in a black and blue wet suit is surfing.	0.09486439824104309
Russia, Ukraine foiled plot to kill Putin, report says	Russian TV reports foiled attempt on Putin	0.5030532479286194
I have  years of "Neener Neener" rights I use lettuce too.	I have  years of Neener Neener rights Usually I get pretty decent care	0.546875536441803
But the justices ruled that the police supervisor who repeatedly questioned Mr Martinez as he screamed in pain did not violate his Fifth Amendment rights.	God bless I'm not outraged, I'm disappointed.	0.12866465747356415
A couple of policewomen are singing karaoke.	Do you understand why non-US residents are also relevant to the statistics?	0.022762678563594818
Two birds flying towards water feeder.	Two birds flying near bird feeders	0.7062915563583374
A boy is sitting in a room playing a piano by lamp light.	A boy is playing a piano	0.7383235692977905
A school bus is driving uphill on a rural road.	a bus driving in a street	0.5703955292701721
More than 30 striking miners killed in South Africa	South Africa police say they killed 30 miners	0.7747727036476135
Originally Posted by zaf in the long term, yes.	How exactly are they being punished?	0.007704898715019226
Mayawati demands president's rule in Kashmir	Mayawati demands Presidents rule in Jammu and Kashmir	0.929360568523407
