sentence_1	sentence_2	score
Five People Charged With Terror Offences	Minn Terminal Reopens After Bag Causes Evacuation	0
Indian stocks open flat	Bulgaria President Backs Protesters, Opposes Snap Elections	0
Egyptians vote on divisive constitution	Egyptians vote on Islamistbacked constitution	0.9241411089897156
A man is chopping a log with an axe.	A man is chopping a tree trunk with an axe	0.5927477478981018
A man sprays another man with water from a hose.	A man is carrying another man	0.6833027005195618
This after seven health care workers at a public hospital fell ill with flu-like symptoms.	Missouri health officials said he had not been hospitalized and is recovering	0.5285716652870178
State Dept security chief resigns after Benghazi	The Dow Jones industrial average .DJI was off 58.69 points, or 0.64 percent, at 9,137.86.	0.04026069492101669
There are 103 Democrats in the Assembly and 47 Republicans.	At Least 47 Killed In Baquba Blasts	0.6955582499504089
China's online population rises to 618 mln	The Japanese population is nearly  million	0.49268966913223267
Likewise, the 30-year bond <US30YT=RR> slid 1-11/32 for a yield of 4.38 percent, up from 4.30 percent.	NYPD's twitter campaign backfires	0.07179621607065201
Chinese yuan weakens to 6.2816 against USD	Chinas yuan weakens to 62767 against USD Thursday	1.0
10 killed, 12 injured in E. Afghan airport suicide blast	A man on a mountain bike going down an incline.	0.06654178351163864
Photos show N. Korea nuclear readiness	Iran and world powers set for nuclear talks	0.6010527014732361
A man is kite surfing away from the camera.	A person is surfing	0.7391934394836426
A lamb stands near two tiny animals.	A sheep standing near her children	0.5297069549560547
Two-year-old Egyptian twin boys, born with their heads conjoined, have been separated after 26 hours of surgery at the Children's Medical Centre in Dallas.	Instead of one long operation to separate the twins Goodrich and Dr David Staffenberg plan about three with several weeks between each	0.4131358861923218
Dog swimming in the water with a stick in its mouth.	A dog swimming with a stick in its mouth	0.6151040196418762
How much is spent on abortions services?	Part of prolife is the opposition to legalized abortion	0.5146673917770386
A man rises from a swamp.	Two men catching a fish in a swamp	0.14090538024902344
a boat moving in a river.	a boat floats in the water	0.631655216217041
A woman is dicing a potato.	Shares of Fox Entertainment Group Inc., News Corp.'s U.S. media and entertainment arm, fell 45 cents to $26.85 in New York Stock Exchange composite trading.	0.01014418713748455
three young woman jumping into the air to catch a ball.	Iran (Islamic Republic of): Iran steps up relief efforts after quakes kill 227	0.046837352216243744
A man is diving into a pool.	A man is diving into a swimming pool	0.7342163324356079
At least 20 dead in Somalia attacks	At least 20 killed in Syria Saturday	0.7476154565811157
Pro-Palestinian Activists March to UN Headquarters	OPEC producers at a meeting on Wednesday are set to pressure independent oil exporters to contribute to the cartel's next supply cut to allow for the return of Iraqi oil.	0.2756071984767914
A train is at a train station.	A black and white dog is running through grass.	0.04309353604912758
Wreckage from AirAlgerie flight AH5017 found in Mali	Wreckage of Air Algerie plane carrying 116 people found in Mali	0.5607621669769287
Three storey building collapses in Ebute Meta	Five killed in China building collapse	0.6860452890396118
Egypt's Morsi faces trial for prison break, murder, says prosecution	Egypts Morsi faces trial for prison break	0.7751662135124207
Iran, a large important partner for Russia: Novak	Larry Page says Android important not critical	0.4922366142272949
Three children are eating their food.	Raccoons are eating	0.6413542628288269
Ukraine's Yanukovych says he does not plan to resign	Sachin Tendulkar says Im not God Im Sachin	0.5419656038284302
China expands search area for missing plane	Malaysia Airlines plane vanishes on flight to Beijing	0.5145955085754395
China gives US regulators access to audit records	Reactions to the prospect of military action against Syria	0.08423583209514618
A man rides a water toy in the water.	Animals are playing in water	0.5965926647186279
I AM OK WITH MEDICAL USE!!	A boy doing a back flip into a swimming pool.	0
A brown dog is running in a field.	A white and brown dog runs in a field	0.757111668586731
And when asked if he felt regret or guilt about the attack his answer was an adamant "no".	Asked if he felt any regret about theOctober 12 attack the answer was an adamant no	0.7231076955795288
Before it was removed, the site listed in broken English the rules for hackers who might participate.	According to law enforcement officials the person arrested was a known sophisticated hacker	0.380083829164505
A young boy pulls another boy wearing a silly hat in a radio flyer wagon.	A young boy is twisting a sparkler around in the air	0.5705685019493103
China ‚Äėwill protect interests‚Äô of foreign business	She had only a single condition, that the book not be published until her death.	0.005846536718308926
A man is mowing grass.	A man is mowing a lawn	0.7335925698280334
mexico wishes to guarantee citizens' safety. 	Stock index futures point to lower start	0.06342825293540955
A little girl walks on a boardwalk with blue domes in the background.	The girl wearing a blue shirt is running through a science center	0.4500354826450348
Monty Python to reunite on stage	Monty Python to reunite for new show	0.5512036681175232
His protest led to a 47-hour standoff with police that caused huge traffic jams in downtown Washington and northern Virginia.	That triggered a 47hour police standoff that inconvenienced thousands of commuters as traffic backed up in Downtown Washington and northern Virginia	0.6103416085243225
A flat screen TV on the floor.	DRINKING green tea can dramatically reduce the risk of men contracting prostate cancer, a study by Australian researchers has discovered.	0.010719881393015385
police stated that-- chung has been on the run.	A county firefighter, was struck by lightning and was in stable condition at Frankfort Regional Medical Center.	0.0489426851272583
A person above their surfboard on the water.	A person is surfing	0.6395263671875
A girl wearing green twists something in her hands.	The two dogs blend in with the stuff animals.	0.12546823918819427
A group of people sing.	Cows grazing in a snow covered field.	0.06286601722240448
"It was a final test before delivering the missile to the armed forces.	State radio said it was the last test before the missile was delivered to the armed forces	0.7793828248977661
@edgarblythe, So Lyndon Johnson and John Kennedy were compatible?	He was joined by Chief Justice William H Rehnquist and Justices Sandra Day OConnor and Antonin Scalia	0.6833189725875854
Tata Nano and other Indian small cars fail crash tests	How does worlds cheapest car do in crash test	0.4734593331813812
Violent clashes mark anniversary of Egypt uprising	A man is doing a wheelie on a bike.	0.01772475428879261
iran lies on a major drug route between afghanistan and europe and the persian gulf states. 	iran lies on a major drug trafficking route between afghanistan and europe as well as the persian gulf states	0.9431055188179016
Do you see Obama calling for Cut, Cap and Balance?	Cyracuz What you want to call it is up to you	0.49787870049476624
activists have stated that russia is imprisoning people without evidence of illegal activity. 	russia said the system is a clear threat to russian security 	0.41131097078323364
Freddie Starr Arrested In Savile Abuse Probe	Minn Terminal Reopens After Bag Causes Evacuation	0
Eric Gagne pitched a perfect ninth for his 23rd save in as many opportunities.	Twelve killed as gunmen raid village	0.09315162152051926
Iran, atomic agency in first talks since Rowhani election	Iran nuclear talks start in Geneva	0.5385452508926392
during the clash 7 seven police officers were killed and 4 seriously wounded.	7 police officers were killed and 4 officers were wounded 	0.781561553478241
Telstra applies to list China site in NY	UK Leader Signals Support for Airstrikes on IS in Syria	0.34131354093551636
A dog is laying on the floor.	Car bombing kills 53 in Damascus	0.050198350101709366
Staff writers Selwyn Crawford and Colleen McCain Nelson and Brian Anderson of DallasNews.com contributed to this report.	Obama and OBrien Cast Their Versions of DC White House Correspondents Dinner	0.5079931616783142
Obama canceled meeting with Putin	Chris Brown concerts cancelled new	0.4646945893764496
Briton jailed for 10 years for selling fake bomb detectors	A white and black dog is running out of a yellow and orange tube.	0.09243961423635483
On Monday, EchoStar (DISH: news, chart, profile) shares shrank $1.40, or 4.4 percent, to $30.63.	Allegiant shares rose 4 or 172 percent to 2743 in Thursday morning trading on the Nasdaq Stock Market	0.3614717423915863
The spacecraft is scheduled to blast off between next Wednesday and Friday from a launching site in the Gobi Desert.	The spacecraft is scheduled to blast off as early as tomorrow or as late as Friday from the Jiuquan launching site in the Gobi Desert	0.674444854259491
Nelson Mandela's condition improves	Mandelas condition has improved	0.8600682020187378
However, other unions including the powerful CGT remained opposed to the reform and demanded the government begin fresh negotiations with them.	Germany warns Greece No more money without reforms	0.41091465950012207
A brown dog is playing with a ball in the water.	A brown dog wades in the water	0.626752495765686
Mayor Joe T. Parker said late Thursday that the three workers were two men and a woman who were inside the building when the first blast occurred.	Among the workers the researchers found short workers had worse hearing than expected for their age	0.4168597459793091
A man plays an acoustic guitar.	The Standard & Poor's 500 stock index ended the quarter up 120 points, a gain of 14 percent, the best performance for that broad market benchmark since 1998.	0.027371902018785477
"If we could do that throughout the world, we could end terrorism," he said.	Negotiators said Friday they made progress during their latest round of free-trade negotiations between the United States and five Central American countries this week in Houston.	0.14432218670845032
Kenya Red Cross says death toll rises to 68	Shots, Explosions Heard as Thais Continue Protest in Bangkok	0.036579474806785583
The Federal Trade Commission asked Congress yesterday for broader powers to attack the rapidly growing problem of spam, which new studies show accounts for half of all e-mail traffic.	A new worm has been spreading rapidly across the Internet sometimes pretending to be an email from Microsoft Chairman Bill Gates antivirus vendors said Monday	0.3817644417285919
At 11 a.m. EDT, Fabian's center was near latitude 18.1 north and longitude 53.2 west, or about 550 miles east of the Leewards.	At 5 pm EDT Graces center was near latitude 256 north longitude 937 west or about 280 miles eastsoutheast of Corpus Christi	0.6642630696296692
Four people are rowing a boat near the shore.	Man rowing a boat	0.8171970844268799
Brooks pleads not guilty at phone hacking hearing	Sienna Miller testifies at UK phone hacking trial	0.5937560796737671
China yuan weakens to 6.1510 against USD	Chinese yuan weakens to 62816 against USD	1.0
A skier wearing blue snow pants is flying through the air near a jump.	Pakistani girl shot by Taliban appears on video	0.07246911525726318
NATO ups military presence amid Russian threat	Chinese military reaches out amid South China Sea tensions	0.49167558550834656
He said the attackers left behind leaflets urging workers at the Ishtar Sheraton to stop working at the hotel.	The priest, the Rev. John F. Johnston, 64, of 35th Avenue in Jackson Heights, was charged with aggravated harassment and criminal possession of a weapon.	0.16136114299297333
Egypt's leader imposes state of emergency in 3 cities	Egypt announces onemonth state of emergency nationwide	0.4793963134288788
A woman is riding on an elephant.	A woman is riding an elephant	0.6335659623146057
the book states that the drug conveys a completely positive image. 	A man is writing in a book	0.3763940632343292
Iran, a large important partner for Russia: Novak	Google CEO says Android important not critical	0.4922366142272949
Douglas Robinson, CA senior vice president, finance, will fill the position in the interim.	Chinese president meets Indian vice president	0.3017389476299286
The committee would propose a replacement for the "Robin Hood" school finance system.	Dewhursts proposal calls for an abrupt end to the controversial Robin Hood plan for school finance	0.3797864019870758
Malaysia: Chinese satellite found object in ocean	Chinese satellite spots large object in search area	0.5948693752288818
GE posts 9% profit drop for third quarter	General Electric posts 9 profit drop for third quarter	0.9158365726470947
A woman is cutting broccoli.	A woman cuts up broccoli	0.568230152130127
"I came to Washington basically to establish relationships and make sure we are getting more federal money," Schwarzenegger said after one meeting.	Turkeys Erdogan in Iran to mend ties after split over Syria	0.4541736841201782
Women drivers to face insurance premium rise	Relief is in sight for Texans saddled with skyrocketing homeowners insurance premiums	0.641144871711731
A topless woman with her face painted is covered in mud.	A young woman topless except for paint or mud	0.44607308506965637
Malaysia Airlines plane vanishes on flight to Beijing	A plane is taking off	0.742672860622406
a black and white dog running through some red and white poles	A black and white dog is running through the field	0.7549628615379333
Italy bus crash death toll rises	Police raise death toll in bus accident to 8	0.7830342054367065
LOL, you are so ignorant.	The ignorance is yours	0.15472401678562164
Zambia's ex-President Rupiah Banda arrested	Musharraf arrested in Lal Masjid case	0.8239064812660217
Malaysia Airlines investigating co-pilot on missing flight	Sandy strengthens as nears coast; Wall Street shut	0.11076333373785019
Assad says Syria will comply with UN arms resolution	UN to take up Syria resolution	0.5067200064659119
Bradley triumphs at Firestone as Furyk fades	A red moped parked on a sidewalk in front of graffiti.	0.05278273671865463
A dog biting on a can.	A dog is biting a mop	0.6364200115203857
A black dog is staring at a sheep.	A black dog looking at a brown sheep in a pen	0.5459344387054443
A woman is bathing into bath-tub.	A woman is taking a bath	0.8412135243415833
France's Strauss-Kahn charged with involvement in prostitution vice ring	A woman rides an elephant in front of an adoring crowd.	0.06418421119451523
The show's closure affected third-quarter earnings per share by a penny.	Stripping out the extraordinary items fourthquarter earnings were 64 cents a share compared to 25 cents a share in the prior year	0.4270623028278351
A boy is trying to say firetruck.	A boy is screaming	0.5010018944740295
Smeone is laying down.	A man is laying on the ground	0.48405230045318604
The woman is cracking eggs into a bowl.	A woman is cracking eggs into a bowl	0.8585984706878662
Trouble flared when at least four North Korean reporters rushed from the Taegu media centre to confront a dozen activists protesting against human rights abuses in the North.	Fighting erupted after four North Korean journalists confronted a dozen South Korean activists protesting human rights abuses in the North outside the main media centre	0.8807335495948792
Food price hikes raise concerns in Iran	Typhoon death toll rises to 3633	0.4162152111530304
Suspected drone strike kills 4 in Pakistan	US drone strike kills four in North Waziristan	0.9698149561882019
India's top court orders investigation into job scam, deaths	Spaniard on trial for Cuban dissident’s death	0.5557949542999268
Two little boys are playing on a playground.	Some kids play in a field	0.5079591274261475
A man is cutting a paper.	A panda is sliding down a slide.	0.1781591773033142
Spot gold was quoted at $358.65/359.15 an ounce at 0500 GMT, having darted as high as $359.25 -- a level not seen since February 25.	Spot gold was quoted at 3679036860 an ounce at 1000 GMT having marched up to 36950  a level not seen since February 10	0.7419029474258423
The Nazis lowered the minimum age to buy a firearm from  to .	Amazons Bezos buys Washington Post for 250M	0.3771422505378723
The two dogs are playing fetch in the snow.	Two dogs are playing in the snow	0.6371183395385742
As far as legality goes I can use jury nullification.	Double Jeopardy actually enforces a jury nullification	0.5171281099319458
Halabi's military attorney, Air Force Maj. James Key, denied the charges, which could carry a death penalty.	If convicted of the spying charges he could face the death penalty	0.3094279170036316
Floods kill two, forces 75,000 from Calgary homes	US Military Deaths in Afghanistan at 2,153	0.04994245991110802
Four dogs splashing in the water	Brown dog splashing into the water	0.8601272702217102
A soccer player scores a goal.	A soccer player kicks the ball into the goal	0.692945659160614
A rat like creature is smelling around.	A rat is running	0.5890334248542786
the treaty was first signed in 1990. 	the cfe treaty was signed in 1990	0.7279656529426575
during the clash 7 seven police officers were killed and 4 seriously wounded.	Two dead 7 injured in Finland shooting	0.5271413326263428
Nevada: 2 dead, 2 hurt in middle school shooting	Two men are fighting in a cattle pen.	0.03194687142968178
Two year doping ban for Contador	Ukrainian weightlifter gets fouryear doping ban	0.7602084875106812
south korea has so far taken a cautious stance on the issue of the north korean nuclear reactor project.	wi sunglac refused to give any details about the north korean nuclear reactor project 	0.7081071138381958
iran insists that its nuclear program is for peaceful purposes	Suarez set for Cup comeback	0.1294669210910797
Insight: U.N. chief finds his voice, but remains cautious on China	Ryanair chief hails report findings	0.3788178563117981
Brazilian leader holds crisis talks on street protests	Ukrainian presidency says deal reached at crisis talks	0.5660881400108337
A girl wearing black shorts and boots is standing next to a blue motorcycle.	A closeup of a woman with black boots next to a blue motorcycle	0.6526904702186584
Mexico swears in president amid violent protests	Thai protests escalate amid violence	0.6268394589424133
Two dogs in a stream.	At the accident scene, the driver was "covered in blood" but helped to remove children, Wood said.	0.03424988314509392
India says China agrees retreat to de facto border in faceoff deal	India accuses China of crossing de facto border	0.5152870416641235
Tell me exactly which system isn't working right now?	CryptoLutheran No We have a Christian in office right now	0.2675139307975769
The man lifted barbells.	A man is lifting a barbell	0.685093879699707
Saudi Arabia to grant Lebanese army $3 billion	Other countries are owed at least US80 billion 10852 billion	0.5937337279319763
70 retailers agree to new Bangladesh factory safety pact	US retailers agree to Bangladesh plant safety pact	0.8095304369926453
US soldier kills up to 16 civilians in Afghanistan	US soldier kills up to 16 Afghan civilians in shooting spree	0.9102116227149963
We never got out of it in the first place!	Ann Romney has never had to get out and be a part of the workforce	0.4298703968524933
Death toll rises to 39 in Italy coach crash	Death toll rises in Russia plane crash	0.6221644282341003
Someone is playing piano.	Someone is playing a piano	0.5374967455863953
He will replace Ron Dittemore, who announced his resignation April 23.	In an Email statement to the Knoxville News Sentinel Shumaker said I am not giving any consideration to resignation	0.6090736985206604
Obama team raises debate stakes	Highlights of the Vice Presidential debate	0.6280569434165955
A man is running.	A man with glasses and two plastic bottles in the foreground.	0.22423657774925232
It can store more than a gigabyte of information equivalent to around 12 hours of music in one cubic centimetre.	And it can store more than a gigabyte of information  equivalent to 1000 high quality images or around 12 hours of music  in just one cubic centimetre	0.8468317985534668
Egypt: Child killed in Cairo clashes after pro-Morsi protest	A bicyclist in black on a black and red racing bike.	0.07482700049877167
A girl jumping rope on a sidewalk with a parking garage to the left.	A girl jumping rope on a sidewalk near a parking garage	0.9237252473831177
Putin sworn in as Russian growth falters	Rudd sworn in as new Australian PM	0.5602599382400513
After that, college President Paul Pribbenow told him to wrap up his speech.	After Hedges microphone was unplugged for a second time Pribbenow told him to wrap up his speech	0.5639402270317078
The plant would employ 1,000 people when fully built out, the company said.	Rebels kill two park rangers in eastern Congo	0.0970628634095192
A man is slicing an onion.	A person is slicing an onion	0.65017169713974
A dog is licking a baby.	A dog licks up a babys drool	0.7092705965042114
Syria rebels leave besieged Homs	Syrian rebels retreat from besieged Homs district	0.7956896424293518
NATO strongly condemns Syria's downing of Turkish jet	Missing Malaysia Airlines plane crashes off Vietnam	0.44229012727737427
Earlier on Monday, Grant Thornton SpA repeated previous statements that it was "a victim of fraudulent action".	Grant Thornton claims that it too was the “victim” of a fraud	0.5468167066574097
George W. Bush warns against bitter immigration debate	US Supreme Court issues split ruling on Arizona immigration law	0.5144134759902954
Congress twice before passed similar restrictions only to see President Bill Clinton veto them.	Congress twice passed similar bills but thenPresident Clinton vetoed them both times	0.5327087044715881
The same survey a month ago had Street leading Katz 42 percent to 34 percent, with 21 percent undecided.	One month ago in the same poll Katz was leading 46 to 40 percent	0.6097458600997925
The results are to be published in Wednesday's issue of The Journal of the American Medical Association.	The results were released at Tuesdays meeting in Seattle of the American Thoracic Society and will be published in Thursdays New England Journal of Medicine	0.7216302752494812
The Supreme Court said Monday the government can require public libraries to equip computers with anti-pornography filters, rejecting librarians' complaints that the law amounts to censorship.	The new law requires libraries and schools to use filters or lose federal financing	0.375535786151886
Someone is putting ingredients into a wok.	A woman is pouring ingredients into a frying pan	0.6077785491943359
Stocks to watch on Monday	the international atomic energy agency may have been tricked because it was eager for a deal. 	0.05254083871841431
A man sprays another man with water from a hose.	A man is spraying a fluid from a long hose at the beach	0.49344468116760254
A man is shown slicing a carrot with a knife.	A woman is cutting up a carrot with a knife	0.6467507481575012
Four Asian young people sitting in a den or living room.	Four people are sitting around a living room withsnacks	0.6646442413330078
A woman is adding pasta to a pot of water.	A woman is placing food in a pot of hot water	0.5222083926200867
Florida Sen. Bob Graham was not identifiable by 61 percent of those polled.	Based on a separate survey of households the unemployment rate fell in August to 61 percent from 62 percent	0.5431063771247864
A pot of food is placed in the center of a red tablecloth.	A pot of liquid is at the center of a tinfoil covered plate	0.5766471028327942
Hong Kong student leaders mull protest retreat	china's council of agriculture opens a special office in charge of agricultural technology transfers and intellectual property rights management and consultancy to enhance development of china's knowledge-based agriculture and applications of agricultural technology. 	0.1370059996843338
Russia, China in double veto of UN Syria resolution	Russia China veto UN resolution on Syria killings	0.6964503526687622
Lewis Hamilton wins inaugural Russian GP	Miami Heat wins NBA Finals	0.713442862033844
myanmar was formerly known as burma. 	Police kill gunman, find 3 more dead in Colo. home	0.02553126960992813
A close-up of a cat on a cream sofa.	UN urges Syria gas attack inspection	0.055841363966464996
ArQule stock plunges as lung cancer study shelved	Angelina Jolies aunt dies of breast cancer	0.4494217336177826
The House voted 425 to 2 to clear the bill, the first of 13 that Congress must pass each year to fund the federal government.	The bill is among the first of 13 that Congress must pass each year to fund the federal government	0.788981020450592
A man is playing soccer.	Some men are playing soccer	0.5608265399932861
A black dog is running in snow.	A black dog is running through the snow	0.757013738155365
Spanish government approves tight restrictions on abortion	Texas house provisionally approves abortion law	0.5295475721359253
Five more human cases of West Nile virus, were reported by the Mesa County Health Department on Wednesday.	On Monday China said nine more people had died from SARS and that 160 more were infected with the virus	0.3517259955406189
Australian PM Kevin Rudd calls election for 7 September	Greek PM calls for May 6 general election	0.673459529876709
A living room with a dining table in the background.	A living room with large sofas and a dining table in the background	0.8190591335296631
A young female rider on a brown horse.	A young girl riding a brown horse	0.6879675388336182
